Invoice,StockCode,Description,Quantity,transaction_date,Price,Customer ID,Country,Total_Value
507372,47590,BLUE HAPPY BIRTHDAY BUNTING,3,03/12/2009,5.45,13634,United Kingdom,16.35
523954,21212,PACK OF 72 RETROSPOT CAKE CASES,24,18/10/2010,0.55,17123,United Kingdom,13.20
503693,85099,JUMBO BAG STRAWBERRY,1,22/10/2010,1.95,16782,United Kingdom,1.95
516928,22070,SMALL RED RETROSPOT MUG IN BOX,36,20/04/2010,3.39,15431,United Kingdom,122.04
491186,84255,ORANGE COCKTAIL GLASS LAMP,3,23/06/2010,2.10,15889,United Kingdom,6.30
495763,ADJUS,Adjustment by john on 26/01/2010 16,1,26/10/2010,107.14,16047,EIRE,107.14
527297,47590,BLUE HAPPY BIRTHDAY BUNTING,3,25/02/2010,5.45,15615,United Kingdom,16.35
493865,47556,TEA TIME TEA TOWELS,10,30/07/2010,2.95,15808,United Kingdom,29.50
527913,22804,CANDLEHOLDER PINK HANGING HEART,8,14/07/2010,2.95,14332,United Kingdom,23.60
529843,22175,PINK OWL SOFT TOY,3,13/08/2010,2.95,16065,United Kingdom,8.85
536615,22467,GUMBALL COAT RACK,12,04/05/2010,2.55,14047,United Kingdom,30.60
507438,22081,RIBBON REEL FLORA + FAUNA,5,08/12/2009,1.65,17994,United Kingdom,8.25
504904,22212,FOUR HOOK WHITE LOVEBIRDS,1,11/11/2010,2.10,18069,United Kingdom,2.10
511322,22615,PACK OF 12 CIRCUS PARADE TISSUES,6,28/10/2010,0.29,13975,United Kingdom,1.74
536557,22112,CHOCOLATE HOT WATER BOTTLE,2,24/05/2010,4.95,17841,United Kingdom,9.90
525750,22489,PACK OF 12 TRADITIONAL CRAYONS,24,04/11/2010,0.42,14682,United Kingdom,10.08
508214,21217,RED SPOTTY ROUND CAKE TINS,2,28/09/2010,9.95,15768,United Kingdom,19.90
492750,20814,SILVER FINCH DECORATION,3,05/08/2010,1.25,15768,United Kingdom,3.75
494359,35646,VINTAGE BEAD PINK EVENING BAG,1,31/10/2010,4.25,17962,United Kingdom,4.25
523951,21890,S/6 WOODEN SKITTLES IN COTTON BAG,2,15/03/2010,2.95,14094,United Kingdom,5.90
490676,79323,WHITE CHERRY LIGHTS,4,08/11/2010,5.45,17850,United Kingdom,21.80
496216,35653,VINTAGE BEAD NOTEBOOK,8,03/06/2010,2.95,16802,United Kingdom,23.60
531382,20750,RED RETROSPOT MINI CASES,1,12/01/2010,7.95,16549,United Kingdom,7.95
533112,21883,STARS GIFT TAPE,12,02/12/2010,0.65,15311,United Kingdom,7.80
512709,22381,TOY TIDY PINK RETROSPOT,1,30/05/2010,2.10,16115,United Kingdom,2.10
495531,84507,STRIPES DESIGN MONKEY DOLL,1,01/12/2009,2.55,14606,United Kingdom,2.55
504808,22353,LUNCH BOX WITH CUTLERY FAIRY CAKES,1,17/10/2010,2.55,17841,United Kingdom,2.55
509417,22585,PACK OF 6 BIRDY GIFT TAGS,2,25/07/2010,1.25,17081,United Kingdom,2.50
533466,22726,ALARM CLOCK BAKELIKE GREEN,4,22/12/2009,3.75,18223,United Kingdom,15.00
519173,22666,RECIPE BOX PANTRY YELLOW DESIGN,1,13/12/2009,2.95,18225,United Kingdom,2.95
529099,22792,FLUTED ANTIQUE CANDLE HOLDER,12,09/12/2010,0.85,17034,United Kingdom,10.20
521839,21731,RED TOADSTOOL LED NIGHT LIGHT,12,08/11/2010,1.65,12635,Germany,19.80
533474,22586,FELTCRAFT HAIRBAND PINK AND BLUE,2,28/05/2010,0.85,12838,United Kingdom,1.70
492176,21439,BASKET OF TOADSTOOLS,1,04/12/2009,1.25,17841,United Kingdom,1.25
506434,22211,WOOD STAMP SET FLOWERS,1,21/06/2010,1.65,13173,United Kingdom,1.65
530068,22154,ANGEL DECORATION 3 BUTTONS,1,05/08/2010,0.42,14606,United Kingdom,0.42
498238,85152,HAND OVER THE CHOCOLATE SIGN,6,23/02/2010,2.10,15768,United Kingdom,12.60
501085,22178,VICTORIAN GLASS HANGING T-LIGHT,6,26/03/2010,1.25,17289,United Kingdom,7.50
491998,21488,RED WHITE SCARF HOT WATER BOTTLE,4,11/04/2010,3.95,16858,United Kingdom,15.80
535979,82494,WOODEN FRAME ANTIQUE WHITE,4,07/11/2010,2.95,14099,United Kingdom,11.80
495184,20669,RED HEART LUGGAGE TAG,1,23/02/2010,1.25,17841,United Kingdom,1.25
514507,48185,DOORMAT FAIRY CAKE,1,05/08/2010,7.49,14415,United Kingdom,7.49
508823,22528,GARDENERS KNEELING PAD,12,17/10/2010,1.25,13650,United Kingdom,15.00
503933,21181,PLEASE ONE PERSON METAL SIGN,12,04/05/2010,2.1,18065,United Kingdom,25.20
514721,82613,METAL SIGN CUPCAKE SINGLE HOOK,2,06/05/2010,1.25,15311,United Kingdom,2.50
512569,20828,GLITTER BUTTERFLY CLIPS,12,12/08/2010,2.55,17990,United Kingdom,30.60
510174,22376,AIRLINE BAG VINTAGE JET SET WHITE,2,13/09/2010,6.35,13357,United Kingdom,12.70
533505,22695,WICKER WREATH SMALL,1,04/12/2009,1.45,12890,United Kingdom,1.45
503452,90058,CRYSTAL STUD EARRINGS CLEAR DISPLAY,36,19/08/2010,0.38,16347,United Kingdom,13.68
501145,21136,PAINTED METAL PEARS ASSORTED,8,08/02/2010,1.69,18149,United Kingdom,13.52
492015,21833,CAMOUFLAGE LED TORCH,48,21/11/2010,1.69,14911,EIRE,81.12
526265,22483,RED GINGHAM TEDDY BEAR,6,11/02/2010,2.95,12782,Portugal,17.70
519822,22511,RETROSPOT BABUSHKA DOORSTOP,2,15/11/2010,3.75,18106,United Kingdom,7.50
492391,85150,LADIES & GENTLEMEN METAL SIGN,12,07/12/2009,2.55,13426,United Kingdom,30.60
502598,21614,SET OF 12 ROSE BOTANICAL T-LIGHTS,6,10/05/2010,2.95,14156,EIRE,17.70
525289,21055,TOOL BOX SOFT TOY,1,18/05/2010,8.95,14169,United Kingdom,8.95
527656,21286,RETROSPOT CANDLE LARGE,24,02/12/2009,0.85,16202,United Kingdom,20.40
514184,85099,JUMBO BAG RED RETROSPOT,10,06/12/2009,1.95,13319,United Kingdom,19.50
525980,48129,DOORMAT TOPIARY,1,29/10/2010,7.95,12835,United Kingdom,7.95
537370,22077,6 RIBBONS RUSTIC CHARM,12,20/05/2010,1.65,13155,United Kingdom,19.80
500837,35004,SET OF 3 PINK FLYING DUCKS,2,29/09/2010,5.45,14590,United Kingdom,10.90
494214,20719,WOODLAND CHARLOTTE BAG,40,04/07/2010,0.85,12623,Germany,34.00
513779,20713,JUMBO BAG OWLS,30,29/04/2010,1.95,14282,United Kingdom,58.50
499230,22233,JIGSAW RABBIT AND BIRDHOUSE,1,06/06/2010,1.65,12748,United Kingdom,1.65
498901,21456,2 PICTURE BOOK EGGS EASTER CHICKS,5,17/12/2009,1.25,15311,United Kingdom,6.25
532233,22672,FRENCH BATHROOM SIGN BLUE METAL,3,01/12/2010,1.65,13719,United Kingdom,4.95
531818,21034,REX CASH+CARRY JUMBO SHOPPER,2,12/03/2010,0.95,13069,United Kingdom,1.90
512929,21320,GLASS CHALICE GREEN LARGE,2,28/05/2010,2.55,16710,United Kingdom,5.10
526089,22047,EMPIRE GIFT WRAP,25,23/11/2010,0.42,15281,United Kingdom,10.50
517946,21329,DINOSAURS WRITING SET,4,18/04/2010,1.65,17673,United Kingdom,6.60
516626,21082,SET/20 FRUIT SALAD PAPER NAPKINS,12,17/12/2009,0.85,13402,United Kingdom,10.20
530091,85099,JUMBO BAG RED RETROSPOT,10,23/11/2010,1.95,13975,United Kingdom,19.50
523908,21486,PINK HEART DOTS HOT WATER BOTTLE,6,20/01/2010,3.75,16952,United Kingdom,22.50
534445,22139,RETROSPOT TEA SET CERAMIC 11 PC,1,15/08/2010,4.95,18283,United Kingdom,4.95
490100,84029,KNITTED UNION FLAG HOT WATER BOTTLE,2,11/12/2009,3.75,13001,United Kingdom,7.50
510197,21590,KINGS CHOICE CIGAR BOX MATCHES,3,19/09/2010,1.25,17231,United Kingdom,3.75
505169,82482,WOODEN PICTURE FRAME WHITE FINISH,12,17/05/2010,2.10,17850,United Kingdom,25.20
491979,48194,DOORMAT HEARTS,10,24/01/2010,5.95,13162,United Kingdom,59.50
535799,72802,ROSE SCENT CANDLE IN JEWELLED BOX,1,11/10/2010,4.25,16720,United Kingdom,4.25
524337,22129,PARTY CONES CANDY TREE DECORATION,12,02/07/2010,0.85,14410,United Kingdom,10.20
525289,21054,NURSE'S BAG SOFT TOY,1,22/12/2009,8.95,14169,United Kingdom,8.95
492738,84032,CHARLIE+LOLA PINK HOT WATER BOTTLE,1,05/11/2010,2.95,14527,United Kingdom,2.95
499748,"20,730.00",STRAWBERRY CANDY BAG,-1,29/08/2010,1.25,12909,United Kingdom,-1.25
516962,21754,HOME BUILDING BLOCK WORD,3,27/09/2010,5.95,12476,Germany,17.85
510733,22429,ENAMEL MEASURING JUG CREAM,2,21/06/2010,4.25,15502,United Kingdom,8.50
503265,21218,RED SPOTTY BISCUIT TIN,2,02/12/2009,3.75,12835,United Kingdom,7.50
494240,21911,GARDEN METAL SIGN,12,14/10/2010,1.65,16858,United Kingdom,19.80
500356,22305,COFFEE MUG PINK PAISLEY DESIGN,2,01/12/2009,2.55,16984,United Kingdom,5.10
491321,21558,SKULL LUNCHBOX WITH CUTLERY,4,30/03/2010,2.55,17032,United Kingdom,10.20
489802,16235,RECYCLED PENCIL WITH RABBIT ERASER,1,18/12/2009,0.21,15581,United Kingdom,0.21
532150,22600,CHRISTMAS RETROSPOT STAR WOOD,3,25/03/2010,0.85,16395,United Kingdom,2.55
520561,21871,SAVE THE PLANET MUG,12,18/08/2010,1.25,14769,United Kingdom,15.00
524307,22734,SET OF 6 RIBBONS VINTAGE CHRISTMAS,27,22/12/2009,2.55,17092,United Kingdom,68.85
494233,79323,SILVER CHERRY LIGHTS,8,01/11/2010,6.75,15093,United Kingdom,54.00
520213,35970,ZINC FOLKART SLEIGH BELLS,6,05/10/2010,1.69,17602,United Kingdom,10.14
511990,47599,BLUE PARTY BAGS,1,08/03/2010,2.10,13601,United Kingdom,2.10
527447,22907,PACK OF 20 NAPKINS PANTRY DESIGN,12,31/08/2010,0.85,18065,United Kingdom,10.20
516116,21902,"KEY FOB , FRONT DOOR",3,25/08/2010,0.65,15452,United Kingdom,1.95
492815,20961,STRAWBERRY BATH SPONGE,1,13/08/2010,1.25,17841,United Kingdom,1.25
529791,22487,WHITE WOOD GARDEN PLANT LADDER,4,08/07/2010,8.50,17109,United Kingdom,34.00
491633,21984,PACK OF 12 PINK PAISLEY TISSUES,12,25/04/2010,0.29,17958,United Kingdom,3.48
511027,47556,TEA TIME TEA TOWELS,4,06/06/2010,2.95,13593,United Kingdom,11.80
523744,72741,GRAND CHOCOLATECANDLE,18,15/11/2010,1.45,14992,United Kingdom,26.10
532149,21212,PACK OF 72 RETROSPOT CAKE CASES,24,08/01/2010,0.55,15290,United Kingdom,13.20
532587,22079,RIBBON REEL HEARTS DESIGN,5,17/02/2010,1.65,15024,United Kingdom,8.25
536938,84997,RED 3 PIECE RETROSPOT CUTLERY SET,24,23/11/2010,3.75,14680,United Kingdom,90.00
524112,22736,RIBBON REEL MAKING SNOWMEN,10,18/12/2009,1.65,15358,United Kingdom,16.50
509460,21533,RETRO SPOT LARGE MILK JUG,3,07/07/2010,4.95,12759,Netherlands,14.85
501483,21218,RED SPOTTY BISCUIT TIN,12,30/03/2010,3.75,16652,United Kingdom,45.00
490478,79323,PINK CHERRY LIGHTS,1,25/11/2010,6.75,14896,United Kingdom,6.75
519692,22593,CHRISTMAS GINGHAM STAR,36,13/12/2009,0.85,17222,United Kingdom,30.60
517116,22653,BUTTON BOX,24,20/05/2010,1.95,18172,United Kingdom,46.80
519689,22714,CARD BIRTHDAY COWBOY,12,06/01/2010,0.42,14283,United Kingdom,5.04
500535,47505,MINATURE COLOURED GARDENING SET,3,07/12/2010,4.95,12472,Germany,14.85
536732,20674,GREEN POLKADOT BOWL,8,02/02/2010,1.25,15544,United Kingdom,10.00
493372,21524,SPOTTY HOME SWEET HOME DOORMAT,2,17/01/2010,6.75,15044,United Kingdom,13.50
526190,21391,FRENCH EMROIDR LAVENDER SCENT HEART,6,07/10/2010,2.10,15046,United Kingdom,12.60
525335,20733,GOLD MINI TAPE MEASURE,20,07/10/2010,0.42,14298,United Kingdom,8.40
494391,84789,ENCHANTED BIRD PLANT CAGE,4,21/09/2010,3.75,13787,United Kingdom,15.00
492408,21480,PINK STRIPE HOT WATER BOTTLE,1,17/10/2010,2.95,16987,United Kingdom,2.95
524416,22130,PARTY CONE CHRISTMAS DECORATION,36,10/02/2010,0.85,16148,United Kingdom,30.60
530426,22652,TRAVEL SEWING KIT,10,21/01/2010,1.65,14911,EIRE,16.50
525960,21232,STRAWBERRY CERAMIC TRINKET BOX,1,28/02/2010,1.25,13230,United Kingdom,1.25
534397,85099,JUMBO BAG STRAWBERRY,20,26/09/2010,1.95,16008,United Kingdom,39.00
506758,"79,323.00",BLACK CHERRY LIGHTS,-1,20/08/2010,6.75,13393,United Kingdom,-6.75
503861,21976,PACK OF 60 MUSHROOM CAKE CASES,24,06/12/2010,0.55,13107,United Kingdom,13.20
495313,20996,JAZZ HEARTS ADDRESS BOOK,24,12/05/2010,0.42,13889,United Kingdom,10.08
530957,21421,PORCELAIN ROSE LARGE,12,07/12/2009,1.25,17340,United Kingdom,15.00
492781,79323,GREEN CHERRY LIGHTS,8,11/06/2010,6.75,14105,United Kingdom,54.00
514966,21509,COWBOYS AND INDIANS BIRTHDAY CARD,12,29/11/2010,0.42,14770,United Kingdom,5.04
528329,22694,WICKER STAR,4,18/04/2010,2.10,13891,United Kingdom,8.40
500834,22145,CHRISTMAS CRAFT HEART STOCKING,6,29/10/2010,2.10,13484,United Kingdom,12.60
528441,"82,583.00",HOT BATHS METAL SIGN,-1,07/07/2010,2.10,15719,United Kingdom,-2.10
496130,82494,WOODEN FRAME ANTIQUE WHITE,6,18/01/2010,2.95,14469,United Kingdom,17.70
529990,22494,EMERGENCY FIRST AID TIN,1,26/02/2010,1.25,14505,United Kingdom,1.25
511787,82482,WOODEN PICTURE FRAME WHITE FINISH,6,30/09/2010,2.55,15757,United Kingdom,15.30
505852,21212,PACK OF 72 RETRO SPOT CAKE CASES,24,03/11/2010,0.55,15384,United Kingdom,13.20
535791,22695,WICKER WREATH SMALL,2,14/12/2009,1.45,13230,United Kingdom,2.90
518077,21955,DOORMAT UNION JACK GUNS AND ROSES,4,28/02/2010,7.49,13658,United Kingdom,29.96
515157,22355,CHARLOTTE BAG SUKI DESIGN,10,30/03/2010,0.85,13571,United Kingdom,8.50
531356,85123,WHITE HANGING HEART T-LIGHT HOLDER,10,16/03/2010,2.95,16559,United Kingdom,29.50
504466,22315,200 RED + WHITE BENDY STRAWS,1,28/03/2010,1.25,16259,United Kingdom,1.25
490461,84509,FAIRY CAKE PLACEMATS,1,26/04/2010,3.75,13736,United Kingdom,3.75
533480,21485,RETROSPOT HEART HOT WATER BOTTLE,1,15/10/2010,4.95,17200,United Kingdom,4.95
523316,15056,EDWARDIAN PARASOL BLACK,3,20/08/2010,5.95,17406,United Kingdom,17.85
532983,22624,IVORY KITCHEN SCALES,2,19/11/2010,8.50,14911,EIRE,17.00
533026,82583,HOT BATHS METAL SIGN,2,01/12/2010,2.10,15311,United Kingdom,4.20
497499,21411,GINGHAM HEART DOORSTOP RED,3,22/12/2009,4.25,15176,United Kingdom,12.75
537688,70006,LOVE HEART POCKET WARMER,12,29/03/2010,1.65,17406,United Kingdom,19.80
494214,21429,RED GINGHAM ROSE JEWELLERY BOX,8,28/11/2010,1.65,12623,Germany,13.20
518141,21676,FLOWERS STICKERS,24,11/12/2009,0.38,14401,United Kingdom,9.12
528693,22867,HAND WARMER BIRD DESIGN,3,17/06/2010,2.10,12748,United Kingdom,6.30
503836,22530,MAGIC DRAWING SLATE DOLLY GIRL,192,20/07/2010,0.36,12482,Sweden,69.12
513625,21577,SAVE THE PLANET COTTON TOTE BAG,2,20/01/2010,2.25,14505,United Kingdom,4.50
490374,20983,12 PENCILS TALL TUBE RED SPOTTY,12,27/09/2010,0.85,14239,United Kingdom,10.20
503234,22077,6 RIBBONS RUSTIC CHARM,10,31/10/2010,1.65,15808,United Kingdom,16.50
496232,22047,EMPIRE GIFT WRAP,25,24/11/2010,0.42,14249,United Kingdom,10.50
538095,21114,LAVENDER SCENTED FABRIC HEART,5,26/11/2010,1.25,17097,Spain,6.25
531861,22188,BLACK HEART CARD HOLDER,36,08/07/2010,3.39,17511,United Kingdom,122.04
525219,21907,I'M ON HOLIDAY METAL SIGN,6,11/11/2010,2.10,14905,United Kingdom,12.60
519907,21175,GIN + TONIC DIET METAL SIGN,4,22/09/2010,2.10,15059,United Kingdom,8.40
496094,21121,SET/10 RED SPOTTY PARTY CANDLES,24,19/04/2010,1.25,15192,United Kingdom,30.00
501540,21329,DINOSAURS WRITING SET,2,22/11/2010,1.65,16085,United Kingdom,3.30
499998,84937,KASHMIR FOLKART TUMBLERS,6,10/08/2010,2.10,14156,EIRE,12.60
534187,22244,3 HOOK HANGER MAGIC GARDEN,2,11/10/2010,1.95,16501,United Kingdom,3.90
530073,22092,BLUE PAISLEY TISSUE BOX,1,07/11/2010,1.25,15958,United Kingdom,1.25
522286,22566,FELTCRAFT HAIRBAND PINK AND PURPLE,6,27/10/2010,0.85,14467,United Kingdom,5.10
514554,22315,200 RED + WHITE BENDY STRAWS,1,03/12/2010,1.25,15885,United Kingdom,1.25
495365,22227,"DECORATION, HANGING HEART+MIRROR",5,14/06/2010,0.65,14701,United Kingdom,3.25
503535,22391,PAPERWEIGHT HOME SWEET HOME,6,09/12/2009,2.55,17700,United Kingdom,15.30
511044,22115,METAL SIGN EMPIRE TEA,2,11/04/2010,2.95,16356,United Kingdom,5.90
527424,21812,GARLAND WITH HEARTS AND BELLS,1,28/06/2010,4.95,15068,United Kingdom,4.95
511778,22469,HEART OF WICKER SMALL,12,07/12/2010,1.65,17716,United Kingdom,19.80
534669,22068,BLACK PIRATE TREASURE CHEST,4,12/05/2010,1.65,12577,France,6.60
517316,21929,JUMBO BAG PINK VINTAGE PAISLEY,2,17/11/2010,1.95,17377,United Kingdom,3.90
498903,21681,GIANT MEDINA STAMPED METAL BOWL,2,25/11/2010,9.95,14112,United Kingdom,19.90
504436,21171,BATHROOM METAL SIGN,96,28/10/2010,1.25,14156,EIRE,120.00
490403,22157,ANGEL DECORATION WITH LACE PADDED,1,04/05/2010,0.85,17920,United Kingdom,0.85
523023,82494,WOODEN FRAME ANTIQUE WHITE,12,11/11/2010,2.95,17716,United Kingdom,35.40
520362,22325,MOBILE VINTAGE HEARTS,1,26/05/2010,4.95,17841,United Kingdom,4.95
510354,21239,PINK SPOTTY CUP,8,23/07/2010,0.85,12499,Germany,6.80
519253,21907,I'M ON HOLIDAY METAL SIGN,12,14/04/2010,2.10,14210,United Kingdom,25.20
502815,37500,TEA TIME TEAPOT IN GIFT BOX,1,22/12/2009,9.95,16768,United Kingdom,9.95
503979,21915,RED HARMONICA IN BOX,12,24/06/2010,1.25,13735,United Kingdom,15.00
519217,22432,WATERING CAN PINK BUNNY,6,08/10/2010,1.95,16873,United Kingdom,11.70
536600,71053,WHITE METAL LANTERN,6,13/01/2010,3.39,17850,United Kingdom,20.34
530802,20846,ZINC HEART LATTICE T-LIGHT HOLDER,3,12/09/2010,1.25,17362,United Kingdom,3.75
516629,20750,RED/WHITE DOT MINI CASES,4,28/01/2010,7.95,16736,United Kingdom,31.80
511038,84932,SMALL ORIENTAL BLUE FOLDING STOOL,8,22/03/2010,1.95,14766,United Kingdom,15.60
528071,85019,CURIOUS IMAGES NOTEBOOK SET,24,24/08/2010,1.25,14460,United Kingdom,30.00
490905,22207,FRYING PAN UNION FLAG,1,31/10/2010,4.25,16940,United Kingdom,4.25
525308,22950,36 DOILIES VINTAGE CHRISTMAS,12,14/05/2010,1.45,12644,Germany,17.40
532350,48188,DOORMAT WELCOME PUPPIES,1,20/04/2010,7.95,15998,United Kingdom,7.95
510331,84993,75 GREEN PETIT FOUR CASES,24,01/11/2010,0.42,13081,United Kingdom,10.08
491123,22052,VINTAGE CARAVAN GIFT WRAP,25,01/11/2010,0.42,17043,United Kingdom,10.50
503706,84596,MIXED NUTS LIGHT GREEN BOWL,1,17/11/2010,1.25,14990,United Kingdom,1.25
502841,21034,REX CASH+CARRY JUMBO SHOPPER,1,17/08/2010,0.95,18283,United Kingdom,0.95
532665,22150,3 STRIPEY MICE FELTCRAFT,1,27/09/2010,1.95,14052,United Kingdom,1.95
513305,22621,TRADITIONAL KNITTING NANCY,12,29/11/2010,1.45,15248,United Kingdom,17.40
493667,21292,SMALL STRIPES CHOCOLATE GIFT BAG,64,07/07/2010,0.19,13253,United Kingdom,12.16
528449,"21,755.00",LOVE BUILDING BLOCK WORD,-3,29/01/2010,5.95,13703,United Kingdom,-17.85
502599,22480,RED TEA TOWEL CLASSIC DESIGN,2,10/11/2010,1.25,17301,United Kingdom,2.50
527124,22505,MEMO BOARD COTTAGE DESIGN,41,27/09/2010,4.25,14088,United Kingdom,174.25
526184,22738,RIBBON REEL SNOWY VILLAGE,10,10/12/2009,1.65,17465,United Kingdom,16.50
503606,20972,PINK CREAM FELT CRAFT TRINKET BOX,12,14/06/2010,1.25,17416,United Kingdom,15.00
526710,22909,SET OF 20 VINTAGE CHRISTMAS NAPKINS,36,10/08/2010,0.85,15151,United Kingdom,30.60
515951,84559,3D SHEET OF CAT STICKERS,11,11/04/2010,0.85,17861,United Kingdom,9.35
519698,72807,SET/3 OCEAN SCENT CANDLE JEWEL BOX,4,02/02/2010,4.25,14911,EIRE,17.00
496947,22495,SET OF 2 ROUND TINS CAMEMBERT,1,29/11/2010,2.95,14030,United Kingdom,2.95
518684,20750,RED/WHITE DOT MINI CASES,2,23/03/2010,7.95,12662,Germany,15.90
501789,47562,ENGLISH ROSE IRONING BOARD COVER,3,19/05/2010,3.75,15768,United Kingdom,11.25
509378,21509,COWBOYS AND INDIANS BIRTHDAY CARD,12,10/03/2010,0.42,12389,Australia,5.04
525040,84946,ANTIQUE SILVER TEA GLASS ETCHED,12,20/01/2010,1.25,15859,United Kingdom,15.00
525022,22655,VINTAGE RED KITCHEN CABINET,1,20/01/2010,295.00,17412,United Kingdom,295.00
499123,20828,GLITTER BUTTERFLY CLIPS,1,28/01/2010,2.55,14556,United Kingdom,2.55
508470,21892,TRADITIONAL WOODEN CATCH CUP GAME,2,29/11/2010,1.25,16922,United Kingdom,2.50
530115,20711,JUMBO BAG TOYS,1,25/10/2010,1.95,17190,United Kingdom,1.95
526214,22762,CUPBOARD 3 DRAWER MA CAMPAGNE,2,19/04/2010,14.95,12749,United Kingdom,29.90
507229,22585,PACK OF 6 BIRDY GIFT TAGS,2,16/04/2010,1.25,17530,United Kingdom,2.50
490712,21553,CERAMIC BIRDHOUSE FINCH BLUE LARGE,2,07/12/2009,5.95,13148,United Kingdom,11.90
518266,22470,HEART OF WICKER LARGE,1,19/02/2010,2.95,13140,United Kingdom,2.95
518412,22423,REGENCY CAKESTAND 3 TIER,2,30/07/2010,12.75,17135,United Kingdom,25.50
529352,"71,477.00",COLOUR GLASS. STAR T-LIGHT HOLDER,"-1,152",23/11/2010,2.75,17450,United Kingdom,"-3,168.00"
535954,22776,SWEETHEART CAKESTAND 3 TIER,12,22/04/2010,8.50,17526,United Kingdom,102.00
525436,22680,"FRENCH BLUE METAL DOOR SIGN, 5",20,16/12/2009,1.25,14492,United Kingdom,25.00
504708,21544,SKULLS WATER TRANSFER TATTOOS,12,16/02/2010,0.85,18262,United Kingdom,10.20
530792,85014,BLACK/BLUE DOTS RUFFLED UMBRELLA,9,28/01/2010,5.95,15332,Lithuania,53.55
523013,22534,MAGIC DRAWING SLATE SPACEBOY,24,02/03/2010,0.42,15599,United Kingdom,10.08
507693,15056,EDWARDIAN PARASOL NATURAL,5,30/06/2010,5.95,14055,United Kingdom,29.75
526650,21524,DOORMAT SPOTTY HOME SWEET HOME,10,22/01/2010,6.75,16814,United Kingdom,67.50
492819,21936,RED/WHITE SPOT PICNIC BAG,10,24/10/2010,2.95,16779,United Kingdom,29.50
516734,21915,RED HARMONICA IN BOX,48,03/02/2010,1.25,16555,United Kingdom,60.00
518771,22646,CERAMIC STRAWBERRY CAKE MONEY BANK,4,11/11/2010,1.45,14736,United Kingdom,5.80
508759,21531,RED RETROSPOT SUGAR JAM BOWL,7,05/01/2010,2.55,14680,United Kingdom,17.85
514370,84970,HANGING HEART ZINC T-LIGHT HOLDER,12,08/03/2010,0.85,14693,United Kingdom,10.20
493983,85172,HYACINTH BULB T-LIGHT CANDLES,256,21/06/2010,0.36,13762,United Kingdom,92.16
498142,21977,PACK OF 60 PINK PAISLEY CAKE CASES,24,10/01/2010,0.55,17364,United Kingdom,13.20
502830,22516,CHILDS GARDEN RAKE BLUE,6,28/04/2010,2.10,14378,United Kingdom,12.60
494529,21094,SET/6 RED SPOTTY PAPER PLATES,36,01/07/2010,0.85,15738,United Kingdom,30.60
536184,22092,BLUE PAISLEY TISSUE BOX,2,12/10/2010,1.25,17889,United Kingdom,2.50
521386,21928,JUMBO BAG SCANDINAVIAN PAISLEY,2,24/08/2010,1.95,17085,United Kingdom,3.90
505513,82482,WOODEN PICTURE FRAME WHITE FINISH,6,28/09/2010,2.55,14556,United Kingdom,15.30
502896,85206,CREAM FELT EASTER EGG BASKET,6,20/04/2010,1.65,15527,United Kingdom,9.90
536597,21709,FOLDING UMBRELLA CHOCOLATE POLKADOT,1,01/12/2009,4.95,18011,United Kingdom,4.95
517530,21539,RED RETROSPOT BUTTER DISH,3,19/08/2010,4.95,16094,United Kingdom,14.85
489598,90167,BEADED LOVE HEART JEWELLERY SET,12,06/01/2010,0.85,16620,United Kingdom,10.20
528768,85123,WHITE HANGING HEART T-LIGHT HOLDER,6,09/12/2009,2.95,14181,United Kingdom,17.70
523422,22367,CHILDRENS APRON SPACEBOY DESIGN,8,16/04/2010,1.65,17850,United Kingdom,13.20
498784,"21,648.00",ASSORTED TUTTI FRUTTI SMALL PURSE,-1,31/01/2010,1.25,12755,Japan,-1.25
525447,21592,RETROSPOT CIGAR BOX MATCHES,7,14/11/2010,1.25,16348,United Kingdom,8.75
528125,22158,3 HEARTS HANGING DECORATION RUSTIC,1,17/10/2010,2.95,16903,United Kingdom,2.95
521386,21111,"SWISS ROLL TOWEL, CHOCOLATE SPOTS",2,06/05/2010,2.95,17085,United Kingdom,5.90
522116,21009,ETCHED GLASS STAR TREE DECORATION,6,21/06/2010,1.25,17921,United Kingdom,7.50
500874,20819,SILVER TEDDY BEAR,1,01/12/2010,3.75,16719,United Kingdom,3.75
504848,22207,FRYING PAN UNION FLAG,2,17/09/2010,4.25,14623,United Kingdom,8.50
530434,22139,RETROSPOT TEA SET CERAMIC 11 PC,24,30/04/2010,4.25,17511,United Kingdom,102.00
498055,21391,FRENCH EMROIDR LAVENDER SCENT HEART,6,27/06/2010,2.10,14669,United Kingdom,12.60
522078,22065,CHRISTMAS PUDDING TRINKET POT,12,06/08/2010,1.45,16206,United Kingdom,17.40
524854,20750,RED RETROSPOT MINI CASES,1,21/04/2010,7.95,13969,United Kingdom,7.95
505999,22122,SET OF 2 FANCY FONT TEA TOWELS,12,13/08/2010,2.95,14837,United Kingdom,35.40
513051,22427,ENAMEL FLOWER JUG CREAM,9,19/10/2010,5.95,18245,United Kingdom,53.55
525416,84970,SINGLE HEART ZINC T-LIGHT HOLDER,144,17/11/2010,0.79,16525,United Kingdom,113.76
501138,21457,2 PICTURE BOOK EGGS EASTER DUCKS,1,24/08/2010,1.25,14532,United Kingdom,1.25
526273,22386,JUMBO BAG PINK POLKADOT,2,09/09/2010,1.95,16520,United Kingdom,3.90
495357,48111,DOOR MAT 3 SMILEY CATS,1,03/12/2009,6.75,14879,United Kingdom,6.75
514008,21071,VINTAGE BILLBOARD DRINK ME MUG,12,29/06/2010,1.25,16170,United Kingdom,15.00
526208,21825,PAINTED METAL TREE WITH HOLLY BELLS,2,21/01/2010,1.45,15418,United Kingdom,2.90
524309,"21,336.00",GOLD WASHBAG,-1,20/01/2010,2.95,17696,United Kingdom,-2.95
531357,POST,POSTAGE,2,28/11/2010,18.00,12437,France,36.00
490292,21790,VINTAGE SNAP CARDS,9,29/10/2010,0.85,16723,United Kingdom,7.65
490291,20766,GARDEN PATH SKETCHBOOK,1,08/03/2010,3.75,16541,United Kingdom,3.75
530540,20724,RED RETROSPOT CHARLOTTE BAG,10,04/05/2010,0.85,12793,Portugal,8.50
496341,22411,JUMBO SHOPPER VINTAGE RED PAISLEY,100,22/08/2010,1.65,17107,United Kingdom,165.00
521771,22624,IVORY KITCHEN SCALES,2,26/07/2010,8.50,13931,United Kingdom,17.00
529763,22807,SET OF 6 T-LIGHTS TOADSTOOLS,6,02/11/2010,2.95,14081,United Kingdom,17.70
512567,21977,PACK OF 60 PINK PAISLEY CAKE CASES,24,29/09/2010,0.55,14619,United Kingdom,13.20
534020,20972,PINK CREAM FELT CRAFT TRINKET BOX,1,26/01/2010,1.25,15846,United Kingdom,1.25
534403,21644,ASSORTED TUTTI FRUTTI HEART BOX,1,19/05/2010,1.25,14649,United Kingdom,1.25
499170,21156,RED SPOTTY CHILDS APRON,50,31/10/2010,1.65,16118,United Kingdom,82.50
495367,22189,CREAM HEART CARD HOLDER,2,07/10/2010,3.95,14070,United Kingdom,7.90
525579,22654,DELUXE SEWING KIT,6,31/03/2010,5.95,17421,United Kingdom,35.70
496869,85099,JUMBO BAG STRAWBERRY,20,18/01/2010,1.95,16779,United Kingdom,39.00
514556,15056,EDWARDIAN PARASOL NATURAL,6,05/01/2010,4.95,17850,United Kingdom,29.70
508038,21624,VINTAGE UNION JACK DOORSTOP,3,02/07/2010,5.95,14854,United Kingdom,17.85
533593,84347,ROTATING SILVER ANGELS T-LIGHT HLDR,6,01/11/2010,2.55,12951,United Kingdom,15.30
495237,84970,HANGING HEART ZINC T-LIGHT HOLDER,24,03/10/2010,0.85,17160,United Kingdom,20.40
523921,22393,PAPERWEIGHT VINTAGE COLLAGE,48,22/12/2009,2.10,14646,Netherlands,100.80
525108,84970,SINGLE HEART ZINC T-LIGHT HOLDER,12,26/11/2010,0.95,13803,United Kingdom,11.40
498590,84623,PINK GINGHAM ROSE FLOOR CUSHION,1,05/12/2010,7.95,13044,United Kingdom,7.95
535780,21463,MIRRORED DISCO BALL,1,10/11/2010,5.95,13435,United Kingdom,5.95
515012,22583,PACK OF 6 HANDBAG GIFT BOXES,1,13/07/2010,2.55,15581,United Kingdom,2.55
533550,85099,JUMBO BAG RED RETROSPOT,1,03/10/2010,1.95,17995,United Kingdom,1.95
529597,22580,ADVENT CALENDAR GINGHAM SACK,12,11/05/2010,5.95,17675,United Kingdom,71.40
532647,20770,ABSTRACT CIRCLE JOURNAL,2,18/03/2010,2.55,17243,United Kingdom,5.10
525448,22548,HEADS AND TAILS SPORTING FUN,4,10/09/2010,1.25,16938,United Kingdom,5.00
522629,22649,STRAWBERRY FAIRY CAKE TEAPOT,1,02/11/2010,4.95,15272,United Kingdom,4.95
500335,21682,LARGE MEDINA STAMPED METAL BOWL,1,01/06/2010,4.95,14606,United Kingdom,4.95
513772,21714,CITRONELLA CANDLE GARDEN POT,6,03/10/2010,1.25,17259,United Kingdom,7.50
494916,47591,PINK FAIRY CAKE CHILD'S APRON,2,08/12/2009,1.95,17963,United Kingdom,3.90
491726,84773,RED ROSE AND LACE C/COVER,6,30/03/2010,2.95,12439,Cyprus,17.70
522339,22562,MONSTERS STENCIL CRAFT,36,26/09/2010,1.25,12621,Germany,45.00
518850,35838,S/6 SILVER ORNAMENETAL CANDLE,2,29/04/2010,0.85,14224,United Kingdom,1.70
