Invoice,StockCode,Description,Quantity,transaction_date,Price,Customer ID,Country,Total_Value
506254,POST,POSTAGE,6,10/12/2009,18.00,12714,France,108.00
535961,21901,"KEY FOB , BACK DOOR",1,01/12/2010,0.65,18034,United Kingdom,0.65
495886,22110,BIRD HOUSE HOT WATER BOTTLE,2,02/06/2010,3.45,14577,United Kingdom,6.90
525030,85135,RED DRAGONFLY HELICOPTER,1,03/02/2010,7.95,15351,United Kingdom,7.95
511301,22510,DOORSTOP RUSSIAN DOLL GINGHAM,1,07/12/2010,3.75,14871,United Kingdom,3.75
513926,22488,NATURAL SLATE RECTANGLE CHALKBOARD,12,18/01/2010,1.65,14774,United Kingdom,19.80
504858,22523,CHILDS GARDEN FORK PINK,12,12/11/2010,0.85,18172,United Kingdom,10.20
509139,22617,BAKING SET SPACEBOY DESIGN,3,01/08/2010,4.95,14291,United Kingdom,14.85
521796,20728,LUNCH BAG CARS BLUE,4,24/01/2010,1.65,17220,United Kingdom,6.60
529000,82486,WOOD S/3 CABINET ANT WHITE FINISH,2,05/01/2010,7.95,15620,United Kingdom,15.90
517843,79000,MOROCCAN TEA GLASS,36,18/11/2010,0.85,13856,United Kingdom,30.60
536021,84879,ASSORTED COLOUR BIRD ORNAMENT,24,11/10/2010,1.69,14329,United Kingdom,40.56
491698,21731,RED TOADSTOOL LED NIGHT LIGHT,72,30/09/2010,1.65,12681,France,118.80
529505,22841,ROUND CAKE TIN VINTAGE GREEN,1,27/04/2010,7.95,15167,United Kingdom,7.95
517384,90019,SILVER M.O.P ORBIT BRACELET,1,13/06/2010,4.95,16984,United Kingdom,4.95
498779,21165,BEWARE OF THE CAT METAL SIGN,12,26/11/2010,1.69,14134,United Kingdom,20.28
501473,22356,"CHARLOTTE BAG , PINK/WHITE SPOTS",100,04/03/2010,0.72,17511,United Kingdom,72.00
522443,22563,HAPPY STENCIL CRAFT,3,03/06/2010,1.25,15998,United Kingdom,3.75
499067,84596,SMALL MARSHMALLOWS PINK BOWL,72,09/11/2010,1.06,14911,EIRE,76.32
533112,22694,WICKER STAR,4,11/06/2010,2.10,15311,United Kingdom,8.40
505182,22241,GARLAND WOODEN HAPPY EASTER,4,03/10/2010,1.25,17576,United Kingdom,5.00
498721,22319,HAIRCLIPS FORTIES FABRIC ASSORTED,12,08/01/2010,0.65,13178,United Kingdom,7.80
492290,21158,MOODY GIRL DOOR HANGER,24,09/09/2010,0.38,14966,United Kingdom,9.12
495504,22293,"SPRING DEC , HANGING CHICK GREEN",5,22/11/2010,1.45,16795,United Kingdom,7.25
532954,22141,CHRISTMAS CRAFT TREE TOP ANGEL,6,19/02/2010,2.10,17139,United Kingdom,12.60
521307,22158,3 HEARTS HANGING DECORATION RUSTIC,16,29/10/2010,2.95,16823,United Kingdom,47.20
535331,22114,HOT WATER BOTTLE TEA AND SYMPATHY,4,07/05/2010,3.95,14496,United Kingdom,15.80
536384,22424,ENAMEL BREAD BIN CREAM,8,10/10/2010,10.95,18074,United Kingdom,87.60
517627,21328,BALLOONS WRITING SET,2,02/08/2010,1.65,16428,United Kingdom,3.30
503333,21737,SET 3 WICKER LOG BASKETS,3,15/11/2010,19.95,16133,United Kingdom,59.85
520406,21533,RETRO SPOT LARGE MILK JUG,12,27/09/2010,4.25,16652,United Kingdom,51.00
524270,22138,BAKING SET 9 PIECE RETROSPOT,3,08/12/2009,4.95,16269,United Kingdom,14.85
499273,85035,GARDENIA 3 WICK MORRIS BOXED CANDLE,4,19/11/2010,4.25,17534,United Kingdom,17.00
528916,22634,CHILDS BREAKFAST SET SPACEBOY,1,28/03/2010,9.95,16782,United Kingdom,9.95
524492,"22,383.00",LUNCH BAG SUKI DESIGN,-1,03/11/2010,1.65,14451,United Kingdom,-1.65
503667,37446,MINI CAKE STAND WITH HANGING CAKES,2,16/11/2010,1.45,15493,United Kingdom,2.90
501010,22382,LUNCH BAG SPACEBOY DESIGN,2,11/07/2010,1.65,13715,United Kingdom,3.30
529981,20969,RED FLORAL FELTCRAFT SHOULDER BAG,1,27/05/2010,3.75,16686,United Kingdom,3.75
512604,21936,RED RETROSPOT PICNIC BAG,5,12/01/2010,2.95,14852,United Kingdom,14.75
520522,21698,MOCK LOBSTER FRIDGE MAGNET,2,26/11/2010,0.85,14482,United Kingdom,1.70
531480,22941,CHRISTMAS LIGHTS 10 REINDEER,6,19/11/2010,8.50,13485,United Kingdom,51.00
501767,21843,RETRO SPOT CAKE STAND,2,02/11/2010,10.95,16335,United Kingdom,21.90
503895,22029,SPACEBOY BIRTHDAY CARD,12,19/01/2010,0.42,13278,United Kingdom,5.04
537648,20723,STRAWBERRY CHARLOTTE BAG,10,30/11/2010,0.85,12839,United Kingdom,8.50
514218,21481,FAWN BLUE HOT WATER BOTTLE,6,19/08/2010,2.95,14911,EIRE,17.70
503824,21621,VINTAGE UNION JACK BUNTING,10,14/10/2010,8.50,13593,United Kingdom,85.00
525443,84947,ANTIQUE SILVER TEA GLASS ENGRAVED,6,29/11/2010,1.25,14085,United Kingdom,7.50
510735,21945,STRAWBERRIES DESIGN FLANNEL,12,26/07/2010,0.85,14606,United Kingdom,10.20
510936,47590,PINK HAPPY BIRTHDAY BUNTING,6,20/04/2010,5.45,12701,Germany,32.70
510150,21498,RED SPOTS WRAP,25,08/10/2010,0.42,13093,United Kingdom,10.50
525077,35832,WOOLLY HAT SOCK GLOVE ADVENT STRING,12,19/04/2010,2.95,16485,United Kingdom,35.40
520213,21494,ROTATING LEAVES T-LIGHT HOLDER,60,01/12/2010,1.25,17602,United Kingdom,75.00
516610,22444,GROW YOUR OWN PLANT IN A CAN,24,08/12/2009,1.25,13615,United Kingdom,30.00
511051,84077,WORLD WAR 2 GLIDERS ASSTD DESIGNS,48,11/01/2010,0.21,12911,United Kingdom,10.08
504427,22443,GROW YOUR OWN HERBS SET OF 3,1,02/02/2010,7.95,14030,United Kingdom,7.95
498576,"85,040.00",S/4 PINK FLOWER CANDLES IN BOWL,-7,28/11/2010,1.65,15527,United Kingdom,-11.55
513964,22355,CHARLOTTE BAG SUKI DESIGN,40,17/09/2010,0.85,12380,Belgium,34.00
520406,22508,DOORSTOP RETROSPOT HEART,16,30/11/2010,3.39,16652,United Kingdom,54.24
502856,22528,GARDENERS KNEELING PAD,1,19/09/2010,1.25,14078,United Kingdom,1.25
519730,22145,CHRISTMAS CRAFT HEART STOCKING,1,25/11/2010,2.10,16549,United Kingdom,2.10
518519,90160,PURPLE BOUDICCA LARGE BRACELET,3,07/07/2010,6.95,17482,United Kingdom,20.85
511073,22519,CHILDS GARDEN BRUSH PINK,2,29/11/2010,2.10,13614,United Kingdom,4.20
503193,21770,OPEN CLOSED METAL SIGN,2,12/07/2010,4.95,18242,United Kingdom,9.90
519693,21034,REX CASH+CARRY JUMBO SHOPPER,1,23/11/2010,0.95,14667,United Kingdom,0.95
508858,22585,PACK OF 6 BIRDY GIFT TAGS,1,29/04/2010,1.25,17920,United Kingdom,1.25
506290,22398,MAGNETS PACK OF 4 SWALLOWS,12,13/12/2009,1.25,14911,EIRE,15.00
499758,85066,CREAM SWEETHEART MINI CHEST,1,21/09/2010,12.75,15003,United Kingdom,12.75
530350,82482,WOODEN PICTURE FRAME WHITE FINISH,2,02/12/2009,2.55,14506,United Kingdom,5.10
525018,22596,CHRISTMAS STAR WISH LIST CHALKBOARD,36,04/11/2010,0.85,15290,United Kingdom,30.60
501449,22359,GLASS JAR KINGS CHOICE,6,28/09/2010,2.95,14210,United Kingdom,17.70
537208,22725,ALARM CLOCK BAKELIKE CHOCOLATE,1,08/07/2010,3.75,15889,United Kingdom,3.75
513372,22488,NATURAL SLATE RECTANGLE CHALKBOARD,12,25/04/2010,1.65,14911,EIRE,19.80
497739,22331,WOODLAND PARTY BAG + STICKER SET,1,09/08/2010,1.65,14606,United Kingdom,1.65
532150,21967,PACK OF 12 SKULL TISSUES,6,03/12/2009,0.29,16395,United Kingdom,1.74
535791,22694,WICKER STAR,1,26/10/2010,2.10,13230,United Kingdom,2.10
502272,22185,SLATE TILE NATURAL HANGING,4,31/08/2010,1.65,14344,United Kingdom,6.60
491190,"21,755.00",LOVE BUILDING BLOCK WORD,-3,27/04/2010,5.95,16057,United Kingdom,-17.85
536262,22572,ROCKING HORSE GREEN CHRISTMAS,6,24/03/2010,0.85,14085,United Kingdom,5.10
532146,84997,BLUE 3 PIECE POLKADOT CUTLERY SET,3,17/05/2010,3.75,15039,United Kingdom,11.25
497929,84279,CHERRY BLOSSOM DECORATIVE FLASK,4,25/11/2010,3.75,14302,United Kingdom,15.00
506555,84559,3D SHEET OF CAT STICKERS,12,07/07/2010,0.85,17677,United Kingdom,10.20
494929,"22,357.00",KINGS CHOICE BISCUIT TIN,-1,13/07/2010,4.25,14256,United Kingdom,-4.25
531131,22470,HEART OF WICKER LARGE,6,18/05/2010,2.95,12749,United Kingdom,17.70
504882,22441,GROW YOUR OWN BASIL IN ENAMEL MUG,4,13/10/2010,2.10,14395,United Kingdom,8.40
515916,21124,SET/10 BLUE SPOTTY PARTY CANDLES,1,13/10/2010,1.25,15542,United Kingdom,1.25
514504,22423,REGENCY CAKESTAND 3 TIER,1,17/02/2010,12.75,13782,United Kingdom,12.75
507315,22549,PICTURE DOMINOES,12,26/05/2010,1.45,12490,France,17.40
532558,21181,PLEASE ONE PERSON METAL SIGN,12,02/11/2010,2.10,13693,United Kingdom,25.20
490018,21981,PACK OF 12 WOODLAND TISSUES,"4,320",10/08/2010,0.25,17940,United Kingdom,"1,080.00"
529763,22039,BOTANICAL LILY GIFT WRAP,25,01/12/2010,0.42,14081,United Kingdom,10.50
507387,82597,BOMBS AWAY METAL SIGN,2,11/06/2010,2.10,17137,United Kingdom,4.20
520179,20681,PINK SPOTTY CHILDS UMBRELLA,3,01/12/2010,3.25,16550,United Kingdom,9.75
523002,22624,IVORY KITCHEN SCALES,2,13/06/2010,8.50,16655,United Kingdom,17.00
536255,22834,HAND WARMER BABUSHKA DESIGN,12,11/04/2010,2.10,13267,United Kingdom,25.20
494799,84987,SET OF 36 TEATIME PAPER DOILIES,12,10/12/2009,1.45,16954,United Kingdom,17.40
491006,21232,STRAWBERRY CERAMIC TRINKET BOX,12,19/03/2010,1.25,13557,United Kingdom,15.00
501651,21907,I'M ON HOLIDAY METAL SIGN,2,05/12/2010,2.10,16385,United Kingdom,4.20
491634,20681,PINK SPOTTY CHILDS UMBRELLA,3,10/11/2010,3.25,17841,United Kingdom,9.75
519700,21231,SWEETHEART CERAMIC TRINKET BOX,1,25/01/2010,1.25,14722,United Kingdom,1.25
522723,21260,FIRST AID TIN,1,05/05/2010,3.25,14701,United Kingdom,3.25
495401,21833,CAMOUFLAGE LED TORCH,12,08/12/2010,1.69,14329,United Kingdom,20.28
489531,72801,S/4 FESTIVE GREEN DINNER CANDLES,2,21/06/2010,1.25,14871,United Kingdom,2.50
496173,85014,PINK/BROWN DOTS RUFFLED UMBRELLA,1,13/12/2009,5.95,14796,United Kingdom,5.95
512071,37448,CERAMIC CAKE DESIGN SPOTTED MUG,4,03/12/2010,1.49,13736,United Kingdom,5.96
491893,22138,BAKING SET 9 PIECE RETROSPOT,1,19/11/2010,4.95,16805,United Kingdom,4.95
519819,22355,CHARLOTTE BAG SUKI DESIGN,3,03/12/2009,0.85,18106,United Kingdom,2.55
519800,84992,72 SWEETHEART FAIRY CAKE CASES,480,19/11/2010,0.42,18251,United Kingdom,201.60
517527,20727,LUNCH BAG BLACK SKULL.,10,14/01/2010,1.65,14388,United Kingdom,16.50
514279,21936,RED RETROSPOT PICNIC BAG,2,08/12/2010,2.95,14451,United Kingdom,5.90
524235,"20,662.00",FIRST CLASS HOLIDAY PURSE,-300,03/12/2009,0.17,14277,France,-51.00
531437,22654,DELUXE SEWING KIT,3,01/08/2010,5.95,13377,United Kingdom,17.85
502588,21380,WOODEN HAPPY BIRTHDAY GARLAND,6,20/12/2009,2.95,16550,United Kingdom,17.70
500456,21534,DAIRY MAID LARGE MILK JUG,3,17/10/2010,4.95,13497,United Kingdom,14.85
521344,22300,COFFEE MUG DOG + BALL DESIGN,12,22/03/2010,2.55,16735,United Kingdom,30.60
497795,22273,FELTCRAFT DOLL MOLLY,6,13/09/2010,2.95,16954,United Kingdom,17.70
537207,22427,ENAMEL FLOWER JUG CREAM,1,07/04/2010,5.95,17402,United Kingdom,5.95
537758,22149,FELTCRAFT 6 FLOWER FRIENDS,6,28/03/2010,2.10,16122,United Kingdom,12.60
510675,82482,WOODEN PICTURE FRAME WHITE FINISH,1,27/09/2010,2.55,17841,United Kingdom,2.55
494666,85123,WHITE HANGING HEART T-LIGHT HOLDER,5,21/09/2010,2.95,13869,United Kingdom,14.75
526272,22749,FELTCRAFT PRINCESS CHARLOTTE DOLL,4,20/05/2010,3.75,16303,United Kingdom,15.00
520680,22714,CARD BIRTHDAY COWBOY,12,10/05/2010,0.42,15480,Malta,5.04
524181,21906,PHARMACIE FIRST AID TIN,464,27/04/2010,7.13,17450,United Kingdom,"3,308.32"
512245,85226,BLUE PULL BACK RACING CAR,1,12/08/2010,0.55,15901,United Kingdom,0.55
501907,22246,"GARLAND, MAGIC GARDEN 1.8M",4,02/11/2010,1.95,13451,United Kingdom,7.80
496220,21329,DINOSAURS WRITING SET,6,03/09/2010,1.65,15421,United Kingdom,9.90
507393,22169,FAMILY ALBUM WHITE PICTURE FRAME,4,28/03/2010,8.50,14911,EIRE,34.00
496341,21498,RED SPOTS WRAP,50,03/08/2010,0.42,17107,United Kingdom,21.00
526629,22434,BALLOON PUMP WITH 10 BALLOONS,1,14/12/2009,1.95,14527,United Kingdom,1.95
504701,20726,LUNCH BAG WOODLAND,10,08/11/2010,1.65,16722,United Kingdom,16.50
519500,22631,CIRCUS PARADE LUNCH BOX,1,02/09/2010,1.95,16255,United Kingdom,1.95
506099,84658,WHITE STITCHED CUSHION COVER,2,12/10/2010,6.95,17991,United Kingdom,13.90
514516,21471,STRAWBERRY RAFFIA FOOD COVER,2,16/08/2010,3.75,17406,United Kingdom,7.50
526089,22561,WOODEN SCHOOL COLOURING SET,12,29/07/2010,1.65,15281,United Kingdom,19.80
498548,85124,PINK JUICY FRUIT PHOTO FRAME,2,08/12/2010,2.55,17400,United Kingdom,5.10
507616,21928,JUMBO BAG SCANDINAVIAN PAISLEY,100,24/11/2010,1.65,16029,United Kingdom,165.00
517977,84991,60 TEATIME FAIRY CAKE CASES,7,06/12/2010,0.55,16938,United Kingdom,3.85
490389,35971,ROSE FOLKART HEART DECORATIONS,24,31/10/2010,1.25,15484,United Kingdom,30.00
504158,40018,CHERRY DESIGN PAPERLANTERNS,5,03/02/2010,1.95,13001,United Kingdom,9.75
490711,22322,BIRD DECORATION GREEN SPOT,4,03/12/2009,0.85,17841,United Kingdom,3.40
499295,22088,PAPER BUNTING COLOURED LACE,2,05/01/2010,2.95,17883,United Kingdom,5.90
530838,22557,PLASTERS IN TIN VINTAGE PAISLEY,6,28/01/2010,1.65,13395,United Kingdom,9.90
516993,37448,CERAMIC CAKE DESIGN SPOTTED MUG,3,07/09/2010,1.49,15493,United Kingdom,4.47
529082,85123,WHITE HANGING HEART T-LIGHT HOLDER,10,22/02/2010,2.95,14546,United Kingdom,29.50
511083,47590,PINK HAPPY BIRTHDAY BUNTING,24,04/10/2010,5.45,12709,Germany,130.80
528504,22119,PEACE WOODEN BLOCK LETTERS,1,05/01/2010,6.95,16428,United Kingdom,6.95
494868,85063,CREAM SWEETHEART MAGAZINE RACK,2,16/02/2010,16.95,17706,United Kingdom,33.90
526181,22632,HAND WARMER RED RETROSPOT,1,28/11/2010,2.10,12862,United Kingdom,2.10
526712,84879,ASSORTED COLOUR BIRD ORNAMENT,32,21/11/2010,1.69,14154,United Kingdom,54.08
502251,79341,WILLOW BRANCH LIGHTS.,4,09/12/2010,6.75,13869,United Kingdom,27.00
509012,22606,WOODEN SKITTLES GARDEN SET,1,30/05/2010,15.95,17623,United Kingdom,15.95
535953,21733,RED HANGING HEART T-LIGHT HOLDER,4,09/11/2010,2.95,15039,United Kingdom,11.80
490515,75149,STRING CRYSTALS NATURAL,12,07/10/2010,1.25,15479,United Kingdom,15.00
500148,21486,PINK HEART DOTS HOT WATER BOTTLE,4,24/06/2010,3.39,17448,United Kingdom,13.56
532935,22112,CHOCOLATE HOT WATER BOTTLE,12,14/05/2010,4.95,16314,United Kingdom,59.40
531841,"21,844.00",RED RETROSPOT MUG,-5,24/06/2010,2.95,13089,United Kingdom,-14.75
536394,22558,CLOTHES PEGS RETROSPOT PACK 24,48,28/06/2010,1.25,13408,United Kingdom,60.00
512061,"22,617.00",BAKING SET SPACEBOY DESIGN,-1,13/12/2009,4.95,16768,United Kingdom,-4.95
535379,22624,IVORY KITCHEN SCALES,4,29/07/2010,8.50,15796,United Kingdom,34.00
535961,22866,HAND WARMER SCOTTY DOG DESIGN,2,29/03/2010,2.10,18034,United Kingdom,4.20
489766,85049,BRIGHT BLUES RIBBONS,1,21/09/2010,1.25,17818,United Kingdom,1.25
533092,21291,SMALL POLKADOT CHOCOLATE GIFT BAG,16,10/10/2010,0.85,13963,United Kingdom,13.60
491406,21507,"ELEPHANT, BIRTHDAY CARD,",12,18/08/2010,0.42,14081,United Kingdom,5.04
501440,47590,BLUE HAPPY BIRTHDAY BUNTING,1,14/12/2009,5.45,15311,United Kingdom,5.45
504860,22556,PLASTERS IN TIN CIRCUS PARADE,12,02/11/2010,1.65,12402,Belgium,19.80
507020,40016,CHINESE DRAGON PAPER LANTERNS,12,02/03/2010,0.42,17345,United Kingdom,5.04
516337,22423,REGENCY CAKESTAND 3 TIER,2,22/12/2009,12.75,14626,United Kingdom,25.50
537207,22636,CHILDS BREAKFAST SET CIRCUS PARADE,4,29/06/2010,8.50,17402,United Kingdom,34.00
531138,22768,FAMILY PHOTO FRAME CORNICE,6,03/06/2010,9.95,13089,United Kingdom,59.70
519831,20762,GREEN FERN SKETCHBOOK,4,25/01/2010,3.75,13911,United Kingdom,15.00
523013,20914,SET/5 RED SPOTTY LID GLASS BOWLS,6,25/08/2010,2.95,15599,United Kingdom,17.70
515907,21240,BLUE SPOTTY CUP,8,11/05/2010,0.85,13564,United Kingdom,6.80
498442,84458,S/3 RABBIT FLOWER/EGG/CARROT ROPE,12,24/11/2010,0.85,13004,United Kingdom,10.20
520819,21524,DOORMAT SPOTTY HOME SWEET HOME,4,14/07/2010,7.49,13089,United Kingdom,29.96
524957,21110,LARGE CAKE TOWEL PINK SPOTS,2,23/09/2010,6.75,13198,United Kingdom,13.50
511445,22139,RETRO SPOT TEA SET CERAMIC 11 PC,3,06/12/2009,4.95,14194,United Kingdom,14.85
508627,21464,DISCO BALL ROTATOR BATTERY OPERATED,1,03/12/2010,4.25,16932,United Kingdom,4.25
527935,84360,TABLE LAMP WHITE SHADE WOOD BASE,3,26/11/2010,5.95,16719,United Kingdom,17.85
525706,22494,EMERGENCY FIRST AID TIN,4,19/09/2010,1.25,17075,United Kingdom,5.00
531791,22386,JUMBO BAG PINK POLKADOT,20,25/02/2010,1.95,14841,United Kingdom,39.00
532756,22112,CHOCOLATE HOT WATER BOTTLE,3,08/04/2010,4.95,14769,United Kingdom,14.85
523286,22584,PACK OF 6 PANNETONE GIFT BOXES,3,17/12/2009,2.55,14716,United Kingdom,7.65
490068,22353,LUNCHBOX WITH CUTLERY FAIRY CAKES,12,16/06/2010,2.55,13085,United Kingdom,30.60
491679,21210,SET OF 72 RETRO SPOT PAPER DOILIES,1,22/11/2010,1.45,16127,United Kingdom,1.45
521767,47503,ASS FLORAL PRINT SPIRIT LEVEL,2,02/03/2010,1.95,15752,United Kingdom,3.90
510549,21411,GINGHAM HEART DOORSTOP RED,2,24/02/2010,4.25,13719,United Kingdom,8.50
505052,82483,WOOD 2 DRAWER CABINET WHITE FINISH,4,25/08/2010,4.95,17850,United Kingdom,19.80
500751,72801,S/4 BURGUNDY WINE DINNER CANDLES,12,24/05/2010,1.25,13081,United Kingdom,15.00
510437,"85,042.00",ANTIQUE LILY FAIRY LIGHTS,-1,20/08/2010,4.95,15916,United Kingdom,-4.95
522984,22578,WOODEN STAR CHRISTMAS SCANDINAVIAN,8,09/11/2010,0.85,17027,United Kingdom,6.80
535014,22147,FELTCRAFT BUTTERFLY HEARTS,24,29/03/2010,1.45,14257,United Kingdom,34.80
510733,84692,BOX OF 24 COCKTAIL PARASOLS,25,13/06/2010,0.42,15502,United Kingdom,10.50
525366,22615,PACK OF 12 CIRCUS PARADE TISSUES,1,13/05/2010,0.29,17019,United Kingdom,0.29
535282,22727,ALARM CLOCK BAKELIKE RED,4,12/05/2010,3.75,14099,United Kingdom,15.00
503842,22499,WOODEN UNION JACK BUNTING,3,15/07/2010,5.95,16369,United Kingdom,17.85
504682,15056,EDWARDIAN PARASOL PINK,1,26/02/2010,5.95,14099,United Kingdom,5.95
526192,16047,POP ART PEN CASE & PENS,6,19/04/2010,0.85,17518,United Kingdom,5.10
506412,22316,200 BENDY SKULL STRAWS,12,24/03/2010,1.25,16607,United Kingdom,15.00
523659,20719,WOODLAND CHARLOTTE BAG,1,28/04/2010,0.85,18096,United Kingdom,0.85
499636,47566,PARTY BUNTING,5,01/11/2010,4.65,13050,United Kingdom,23.25
534203,21591,COSY HOUR CIGAR BOX MATCHES,2,14/11/2010,1.25,14583,United Kingdom,2.50
493716,72802,ROSE SCENT CANDLE IN JEWELLED BOX,5,11/02/2010,4.25,17364,United Kingdom,21.25
490728,84944,SET OF 6 KASHMIR FOLKART BAUBLES,1,28/07/2010,4.25,16702,United Kingdom,4.25
515627,22296,HEART IVORY TRELLIS LARGE,12,03/12/2009,1.65,17096,United Kingdom,19.80
517869,20748,KENSINGTON COFFEE SET,2,10/05/2010,12.75,17848,United Kingdom,25.50
498596,84846,SCENTED CANDLE IN DIGITALIS TIN,6,02/08/2010,2.10,13152,United Kingdom,12.60
498797,22414,DOOR MAT NEIGHBOURHOOD WITCH,1,23/07/2010,7.49,15493,United Kingdom,7.49
509950,"79,320.00",FLAMINGO LIGHTS,-1,26/11/2010,4.25,17511,United Kingdom,-4.25
522950,22061,LARGE CAKE STAND HANGING STRAWBERY,1,26/09/2010,9.95,13542,United Kingdom,9.95
510727,21222,SET/4 BADGES BEETLES,2,07/12/2009,1.25,14646,Netherlands,2.50
495036,"79,191.00",RETRO PLASTIC ELEPHANT TRAY,-1,02/12/2010,0.85,13319,United Kingdom,-0.85
500999,21062,PARTY INVITES SPACEMAN,3,18/12/2009,0.85,16933,United Kingdom,2.55
515192,21539,RED RETROSPOT BUTTER DISH,12,03/08/2010,4.95,18225,United Kingdom,59.40
533485,22118,JOY WOODEN BLOCK LETTERS,1,31/08/2010,4.95,14811,United Kingdom,4.95
532449,22284,HEN HOUSE DECORATION,12,24/11/2010,1.65,15476,United Kingdom,19.80
520230,72133,COLUMBIAN CANDLE RECTANGLE,24,19/04/2010,0.38,14401,United Kingdom,9.12
505172,22169,FAMILY ALBUM WHITE PICTURE FRAME,16,22/10/2010,7.65,16525,United Kingdom,122.40
523161,21985,PACK OF 12 HEARTS DESIGN TISSUES,24,17/09/2010,0.29,14146,United Kingdom,6.96
495686,22112,CHOCOLATE HOT WATER BOTTLE,4,11/12/2009,4.95,15044,United Kingdom,19.80
499521,85124,GREEN JUICY FRUIT PHOTO FRAME,36,28/06/2010,2.10,13694,United Kingdom,75.60
525200,22521,CHILDS GARDEN TROWEL PINK,1,23/11/2010,0.85,16444,United Kingdom,0.85
512936,20717,STRAWBERRY SHOPPER BAG,40,18/08/2010,1.25,14607,United Kingdom,50.00
493954,84029,RED WOOLLY HOTTIE WHITE HEART.,24,14/07/2010,2.95,18170,United Kingdom,70.80
507157,21901,"KEY FOB , BACK DOOR",6,18/12/2009,0.65,16814,United Kingdom,3.90
506391,85065,CREAM SWEETHEART TRAYS,1,22/01/2010,12.75,18111,United Kingdom,12.75
521978,20967,GREY FLORAL FELTCRAFT SHOULDER BAG,4,01/02/2010,3.75,12760,Netherlands,15.00
515906,21722,SWEET PUDDING STICKER SHEET,2,15/11/2010,0.85,12748,United Kingdom,1.70
492776,72129,COLUMBIAN CANDLE ROUND,12,30/07/2010,0.65,15326,United Kingdom,7.80
536846,21912,VINTAGE SNAKES & LADDERS,1,17/08/2010,3.75,14573,United Kingdom,3.75
537772,16235,RECYCLED PENCIL WITH RABBIT ERASER,3,20/10/2010,0.21,18043,United Kingdom,0.63
528752,22456,NATURAL SLATE CHALKBOARD LARGE,3,28/01/2010,4.95,16677,United Kingdom,14.85
513324,22383,LUNCH BAG SUKI DESIGN,2,02/12/2010,1.65,17345,United Kingdom,3.30
522121,22588,CARD HOLDER GINGHAM HEART,6,14/12/2009,2.55,14911,EIRE,15.30
499505,10135,COLOURING PENCILS BROWN TUBE,1,17/11/2010,1.25,14606,United Kingdom,1.25
518983,22027,TEA PARTY BIRTHDAY CARD,12,27/04/2010,0.42,13214,United Kingdom,5.04
533999,35004,SET OF 3 COLOURED FLYING DUCKS,3,26/02/2010,5.45,16228,United Kingdom,16.35
499262,22244,"HOOK, 3 HANGER ,MAGIC GARDEN",12,18/11/2010,1.95,13269,United Kingdom,23.40
502795,84755,COLOUR GLASS T-LIGHT HOLDER HANGING,16,11/08/2010,0.65,16510,United Kingdom,10.40
506434,85213,MINI ZINC GARDEN DECORATIONS,12,26/05/2010,0.85,13173,United Kingdom,10.20
536261,84029,KNITTED UNION FLAG HOT WATER BOTTLE,20,08/02/2010,3.75,16353,United Kingdom,75.00
494649,40016,CHINESE DRAGON PAPER LANTERNS,48,02/08/2010,0.42,17969,United Kingdom,20.16
515465,85136,BLUE SHARK HELICOPTER,1,19/07/2010,7.95,14882,United Kingdom,7.95
508406,"22,300.00",COFFEE MUG DOG + BALL DESIGN,-6,07/10/2010,2.55,13417,United Kingdom,-15.30
518271,22328,ROUND SNACK BOXES SET OF 4 FRUITS,6,15/12/2009,2.95,12633,Germany,17.70
504146,22557,PLASTERS IN TIN VINTAGE PAISLEY,48,17/12/2009,1.65,12481,Germany,79.20
506753,"21,658.00",GLASS BEURRE DISH,-1,23/07/2010,3.95,14911,EIRE,-3.95
529940,22567,20 DOLLY PEGS RETROSPOT,1,26/10/2010,1.25,17142,United Kingdom,1.25
512067,90122,PINK CRYSTAL+GLASS BRACELET,2,02/07/2010,4.95,15751,United Kingdom,9.90
496529,90010,AMBER GLASS/SILVER BRACELET,2,03/11/2010,8.95,12848,United Kingdom,17.90
513772,22118,JOY WOODEN BLOCK LETTERS,1,25/04/2010,4.95,17259,United Kingdom,4.95
518203,79000,MOROCCAN TEA GLASS,24,21/12/2009,0.85,13089,United Kingdom,20.40
495389,84921,CREAM AND PINK FLOWERS PONY,1,28/04/2010,3.75,14044,United Kingdom,3.75
533734,22637,PIGGY BANK RETROSPOT,6,02/07/2010,2.55,17428,United Kingdom,15.30
517859,22577,WOODEN HEART CHRISTMAS SCANDINAVIAN,20,19/10/2010,0.85,13357,United Kingdom,17.00
505771,22520,CHILDS GARDEN TROWEL BLUE,12,14/12/2009,0.85,14493,United Kingdom,10.20
511864,22553,PLASTERS IN TIN SKULLS,1,22/07/2010,1.65,15910,United Kingdom,1.65
521014,21989,PACK OF 20 SKULL PAPER NAPKINS,12,26/04/2010,0.85,17611,United Kingdom,10.20
531221,21156,RETROSPOT CHILDRENS APRON,8,26/11/2010,1.95,12450,Spain,15.60
525885,22294,HEART FILIGREE DOVE SMALL,2,18/12/2009,1.25,12748,United Kingdom,2.50
513961,20726,LUNCH BAG WOODLAND,1,22/12/2009,1.65,15005,United Kingdom,1.65
534539,22423,REGENCY CAKESTAND 3 TIER,2,18/11/2010,12.75,17098,United Kingdom,25.50
501658,84884,ANT WHITE WIRE HEART SPIRAL,4,01/12/2009,3.95,15496,United Kingdom,15.80
528957,20681,PINK POLKADOT CHILDRENS UMBRELLA,6,28/11/2010,3.25,12475,Germany,19.50
490753,21524,SPOTTY HOME SWEET HOME DOORMAT,2,31/10/2010,6.75,17047,United Kingdom,13.50
523924,22423,REGENCY CAKESTAND 3 TIER,16,02/12/2009,10.95,14031,United Kingdom,175.20
527423,21485,RETROSPOT HEART HOT WATER BOTTLE,6,08/10/2010,4.95,14755,United Kingdom,29.70
506162,15060,FAIRY CAKE DESIGN UMBRELLA,4,19/04/2010,3.75,13081,United Kingdom,15.00
514163,71053,WHITE METAL LANTERN,1,13/10/2010,3.75,16283,United Kingdom,3.75
518687,22584,PACK OF 6 PANNETONE GIFT BOXES,6,12/07/2010,2.55,15837,United Kingdom,15.30
513542,47568,ENGLISH ROSE DESIGN PEG BAG,32,31/08/2010,2.10,16779,United Kingdom,67.20
503543,37464,ROBOT MUG IN DISPLAY BOX,1,11/04/2010,1.25,17993,United Kingdom,1.25
532759,21948,SET OF 6 CAKE CHOPSTICKS,8,08/04/2010,1.25,15856,United Kingdom,10.00
500845,22147,FELTCRAFT BUTTERFLY HEARTS,1,02/12/2009,1.45,13413,United Kingdom,1.45
532554,20757,RED DAISY POCKET BOOK,2,10/03/2010,0.85,15983,United Kingdom,1.70
529503,22654,DELUXE SEWING KIT,1,04/06/2010,5.95,16343,United Kingdom,5.95
534869,20971,PINK BLUE FELT CRAFT TRINKET BOX,12,06/12/2010,1.25,13952,United Kingdom,15.00
520039,79320,FLAMINGO LIGHTS,4,27/04/2010,4.95,18223,United Kingdom,19.80
522444,84050,PINK HEART SHAPE EGG FRYING PAN,8,28/10/2010,1.65,17801,United Kingdom,13.20
514556,21504,SKULLS GREETING CARD,12,09/04/2010,0.36,17850,United Kingdom,4.32
509865,47566,PARTY BUNTING,5,19/01/2010,4.65,16844,United Kingdom,23.25
529329,84596,SMALL LICORICE DES PINK BOWL,1,15/01/2010,1.25,14159,United Kingdom,1.25
512386,21731,RED TOADSTOOL LED NIGHT LIGHT,12,13/04/2010,1.65,12472,Germany,19.80
525728,21704,BAG 250g SWIRLY MARBLES,48,18/01/2010,0.85,16873,United Kingdom,40.80
492655,"22,191.00",EAU DE NIL DINER WALL CLOCK,-1,22/12/2009,7.65,15782,United Kingdom,-7.65
512920,21624,VINTAGE UNION JACK DOORSTOP,1,10/10/2010,5.95,17883,United Kingdom,5.95
534753,85123,WHITE HANGING HEART T-LIGHT HOLDER,12,11/10/2010,2.95,17990,United Kingdom,35.40
507122,20979,36 PENCILS TUBE RED SPOTTY,80,15/11/2010,1.25,12678,France,100.00
534800,22489,PACK OF 12 TRADITIONAL CRAYONS,6,12/07/2010,0.42,17019,United Kingdom,2.52
522982,82494,WOODEN FRAME ANTIQUE WHITE,6,25/10/2010,2.95,12867,United Kingdom,17.70
497889,85129,"WHITE PEARL BEADED HEART, SMALL",12,16/09/2010,1.25,17230,United Kingdom,15.00
519213,21927,BLUE/CREAM STRIPE CUSHION COVER,2,11/01/2010,1.25,17377,United Kingdom,2.50
536381,84854,GIRLY PINK TOOL SET,5,09/11/2010,4.95,15311,United Kingdom,24.75
517946,20996,JAZZ HEARTS ADDRESS BOOK,4,06/07/2010,0.42,17673,United Kingdom,1.68
509765,82600,NO SINGING METAL SIGN,12,12/05/2010,2.10,16004,United Kingdom,25.20
502301,21975,PACK OF 60 DINOSAUR CAKE CASES,24,21/06/2010,0.55,17082,United Kingdom,13.20
504536,21917,SET 12 KIDS WHITE CHALK STICKS,4,16/11/2010,0.42,13097,United Kingdom,1.68
524307,84997,GREEN 3 PIECE POLKADOT CUTLERY SET,1,06/12/2010,3.75,17092,United Kingdom,3.75
536538,22603,CHRISTMAS RETROSPOT TREE WOOD,10,02/11/2010,0.85,14594,United Kingdom,8.50
516327,84968,S/16 VINTAGE ROSE CUTLERY,1,18/10/2010,12.75,17589,United Kingdom,12.75
537354,21723,ALPHABET HEARTS STICKER SHEET,1,05/11/2010,0.85,12748,United Kingdom,0.85
521287,84976,RECTANGULAR SHAPED MIRROR,6,29/10/2010,1.69,16100,United Kingdom,10.14
