Invoice,StockCode,Description,Quantity,transaction_date,Price,Customer ID,Country,Total_Value
506688,85123,WHITE HANGING HEART T-LIGHT HOLDER,2,02/09/2010,2.95,17565,United Kingdom,5.90
528750,85014,RED RETROSPOT UMBRELLA,1,08/08/2010,5.95,14183,United Kingdom,5.95
511259,22504,CABIN BAG VINTAGE RETROSPOT,1,29/03/2010,29.95,16382,United Kingdom,29.95
523718,22662,LUNCH BAG DOLLY GIRL DESIGN,10,16/12/2009,1.65,13985,United Kingdom,16.50
525760,22896,PEG BAG APPLE DESIGN,50,16/12/2009,2.10,13694,United Kingdom,105.00
533501,22759,SET OF 3 NOTEBOOKS IN PARCEL,1,05/10/2010,1.65,15862,United Kingdom,1.65
524833,22669,RED BABY BUNTING,5,23/11/2010,2.95,17581,United Kingdom,14.75
525167,21912,VINTAGE SNAKES & LADDERS,8,18/02/2010,3.75,12486,Sweden,30.00
521030,22061,LARGE CAKE STAND HANGING STRAWBERY,1,09/07/2010,9.95,14167,United Kingdom,9.95
537792,47420,ASSORTED COLOUR SUCTION CUP HOOK,2,12/08/2010,0.19,16385,United Kingdom,0.38
535883,22595,CHRISTMAS GINGHAM HEART,12,15/12/2009,0.85,15540,United Kingdom,10.20
490494,90179,PURPLE FINE BEAD NECKLACE W TASSEL,1,06/04/2010,5.95,17561,United Kingdom,5.95
528764,51008,AFGHAN SLIPPER SOCK PAIR,10,07/10/2010,3.45,16904,United Kingdom,34.50
534164,21257,VICTORIAN SEWING BOX MEDIUM,2,17/10/2010,7.95,16241,United Kingdom,15.90
507710,44091,BLUE CRUSOE CHECK LAMPSHADE,2,19/08/2010,0.42,13206,United Kingdom,0.84
522983,21925,UNION STRIPE CUSHION COVER,4,19/02/2010,1.25,17913,United Kingdom,5.00
516583,22521,CHILDS GARDEN TROWEL PINK,12,12/03/2010,0.85,16416,United Kingdom,10.20
530571,20659,ECONOMY LUGGAGE TAG,2,22/03/2010,1.25,15752,United Kingdom,2.50
535379,21166,COOK WITH WINE METAL SIGN,6,01/04/2010,1.95,15796,United Kingdom,11.70
493828,22354,RETRO SPOT PADDED SEAT CUSHION,5,09/09/2010,3.75,14732,United Kingdom,18.75
492691,"21,529.00",RETRO SPOT CERAMIC TOASTRACK,-2,04/10/2010,3.45,17095,United Kingdom,-6.90
514526,"22,551.00",PLASTERS IN TIN SPACEBOY,-1,14/04/2010,1.65,15430,United Kingdom,-1.65
521406,22136,LOVE HEART SOCK HANGER,24,05/11/2010,1.65,13093,United Kingdom,39.60
492357,22333,RETRO SPORT PARTY BAG + STICKER SET,2,11/12/2009,1.65,18012,United Kingdom,3.30
502094,21789,KIDS RAIN MAC PINK,5,09/11/2010,0.85,12748,United Kingdom,4.25
504594,22367,CHILDS APRON SPACEBOY DESIGN,4,30/03/2010,1.95,15910,United Kingdom,7.80
502501,90167,BEADED LOVE HEART JEWELLERY SET,12,22/06/2010,0.85,13004,United Kingdom,10.20
493969,82552,WASHROOM METAL SIGN,24,29/07/2010,1.25,14031,United Kingdom,30.00
535267,20984,12 PENCILS TALL TUBE POSY,1,19/02/2010,0.85,14487,United Kingdom,0.85
515338,20677,PINK SPOTTY BOWL,8,15/11/2010,1.25,15544,United Kingdom,10.00
522432,22565,FELTCRAFT HAIRBANDS PINK AND WHITE,1,09/06/2010,0.85,15965,United Kingdom,0.85
495346,22132,RED LOVE HEART SHAPE CUP,12,22/02/2010,0.85,12956,United Kingdom,10.20
520568,21707,"FOLDING UMBRELLA , BLACK/BLUE SPOT",12,24/03/2010,4.95,14031,United Kingdom,59.40
535959,84029,KNITTED UNION FLAG HOT WATER BOTTLE,24,30/03/2010,3.39,15498,United Kingdom,81.36
511026,21713,CITRONELLA CANDLE FLOWERPOT,4,02/12/2009,2.10,14441,United Kingdom,8.40
512651,21218,RED SPOTTY BISCUIT TIN,3,05/10/2010,3.75,17692,United Kingdom,11.25
525407,22046,TEA PARTY WRAPPING PAPER,25,29/11/2010,0.42,15358,United Kingdom,10.50
527414,82567,"AIRLINE LOUNGE,METAL SIGN",3,24/10/2010,2.10,15506,United Kingdom,6.30
495187,21614,SET OF 12 ROSE BOTANICAL T-LIGHTS,6,09/11/2010,2.95,13148,United Kingdom,17.70
524618,22950,36 DOILIES VINTAGE CHRISTMAS,24,20/09/2010,1.45,14911,EIRE,34.80
519011,84991,60 TEATIME FAIRY CAKE CASES,24,05/10/2010,0.55,16592,United Kingdom,13.20
497949,21846,PINK DIAMANTE PEN IN GIFT BOX,3,06/12/2010,4.95,16327,United Kingdom,14.85
521483,22383,LUNCH BAG SUKI DESIGN,20,14/04/2010,1.65,13093,United Kingdom,33.00
506111,21866,UNION JACK FLAG LUGGAGE TAG,6,01/12/2010,1.25,12849,United Kingdom,7.50
529315,21825,PAINTED METAL TREE WITH HOLLY BELLS,12,16/04/2010,1.45,14911,EIRE,17.40
534738,21121,SET/10 RED POLKADOT PARTY CANDLES,24,03/10/2010,1.25,12377,Switzerland,30.00
505335,22561,WOODEN SCHOOL COLOURING SET,24,25/11/2010,1.65,12709,Germany,39.60
529093,84969,BOX OF 6 ASSORTED COLOUR TEASPOONS,6,10/11/2010,4.25,14911,EIRE,25.50
511976,21272,SALLE DE BAIN HOOK,4,25/10/2010,1.25,17191,United Kingdom,5.00
523361,22335,HEART DECORATION PAINTED ZINC,24,10/06/2010,0.65,13214,United Kingdom,15.60
534164,85178,VICTORIAN SEWING KIT,1,08/03/2010,1.25,16241,United Kingdom,1.25
489536,85170,SET/6 PINK BIRD T-LIGHT CANDLES,1,20/12/2009,2.10,16393,United Kingdom,2.10
507261,22174,PHOTO CUBE,3,19/07/2010,1.65,12872,United Kingdom,4.95
506669,84536,ENGLISH ROSE NOTEBOOK A7 SIZE,10,27/09/2010,0.42,14683,United Kingdom,4.20
503604,22356,"CHARLOTTE BAG , PINK/WHITE SPOTS",10,25/11/2010,0.85,14489,United Kingdom,8.50
515420,21328,BALLOONS WRITING SET,6,04/05/2010,1.65,17365,United Kingdom,9.90
515955,21976,PACK OF 60 MUSHROOM CAKE CASES,3,11/06/2010,0.55,14514,United Kingdom,1.65
529837,22748,POPPY'S PLAYHOUSE KITCHEN,1,19/04/2010,2.10,16784,United Kingdom,2.10
532667,21609,SET 12 LAVENDER BOTANICAL T-LIGHTS,1,30/07/2010,2.95,16121,United Kingdom,2.95
502764,20866,BLUE ROSE FABRIC MIRROR,12,09/09/2010,1.25,12477,Germany,15.00
516185,20727,LUNCH BAG BLACK SKULL.,2,09/11/2010,1.65,14546,United Kingdom,3.30
531370,21054,NURSE'S BAG SOFT TOY,1,26/02/2010,8.95,16511,United Kingdom,8.95
520972,21431,GREEN GINGHAM FLOWER JEWELLERY BOX,1,16/06/2010,1.65,12391,Cyprus,1.65
516731,22528,GARDENERS KNEELING PAD,36,08/10/2010,1.25,16555,United Kingdom,45.00
524747,21135,VICTORIAN METAL POSTCARD SPRING,8,30/11/2010,1.69,14156,EIRE,13.52
533301,21134,VICTORIAN METAL POSTCARD CHRISTMAS,1,27/01/2010,1.65,15811,United Kingdom,1.65
498999,21768,WALL MOUNTED VINTAGE ORGANISER,1,16/12/2009,14.95,16406,United Kingdom,14.95
516481,22385,JUMBO BAG SPACEBOY DESIGN,10,04/07/2010,1.95,16945,United Kingdom,19.50
521269,21535,RED RETROSPOT SMALL MILK JUG,12,09/11/2010,2.55,13408,United Kingdom,30.60
512664,22526,WHEELBARROW FOR CHILDREN,1,17/01/2010,12.75,15719,United Kingdom,12.75
521816,22399,MAGNETS PACK OF 4 CHILDHOOD MEMORY,1,19/09/2010,1.25,15555,United Kingdom,1.25
510489,"21,658.00",GLASS BEURRE DISH,-1,24/06/2010,3.39,12709,Germany,-3.39
526455,22728,ALARM CLOCK BAKELIKE PINK,20,18/05/2010,3.75,17004,United Kingdom,75.00
507395,22265,EASTER DECORATION NATURAL CHICK,8,06/09/2010,0.65,13598,United Kingdom,5.20
517793,22283,6 EGG HOUSE PAINTED WOOD,2,30/03/2010,7.95,13888,United Kingdom,15.90
517120,22468,BABUSHKA LIGHTS STRING OF 10,6,21/07/2010,6.75,15142,United Kingdom,40.50
499472,21794,CLASSIC FRENCH STYLE BASKET NATURAL,3,12/11/2010,6.75,14507,United Kingdom,20.25
518847,22088,PAPER BUNTING COLOURED LACE,4,19/02/2010,2.95,13668,United Kingdom,11.80
492317,82552,WASHROOM METAL SIGN,12,23/11/2010,1.25,15615,United Kingdom,15.00
520584,22385,JUMBO BAG SPACEBOY DESIGN,10,05/12/2010,1.95,12839,United Kingdom,19.50
517871,21671,RED SPOT CERAMIC DRAWER KNOB,6,04/11/2010,1.25,16814,United Kingdom,7.50
504834,22606,WOODEN SKITTLES GARDEN SET,1,08/09/2010,15.95,16094,United Kingdom,15.95
497839,22657,HEN & 2 CHICKS IN BASKET,6,18/07/2010,0.85,17954,United Kingdom,5.10
497632,22167,"WALL MIRROR , DIAMANTE OVAL SHAPE",2,31/10/2010,9.95,16918,United Kingdom,19.90
500144,21756,BATH BUILDING BLOCK WORD,3,29/04/2010,5.95,15601,United Kingdom,17.85
527042,22734,SET OF 6 RIBBONS VINTAGE CHRISTMAS,18,13/09/2010,2.55,14911,EIRE,45.90
537523,85123,WHITE HANGING HEART T-LIGHT HOLDER,6,18/08/2010,2.95,14176,United Kingdom,17.70
534847,21264,WHITE GOOSE FEATHER TREE 60CM,14,03/09/2010,1.95,14646,Netherlands,27.30
522082,21365,MIRRORED WALL ART STARS,2,31/10/2010,2.95,16608,United Kingdom,5.90
506700,22063,CERAMIC BOWL WITH STRAWBERRY DESIGN,6,13/09/2010,2.95,13136,United Kingdom,17.70
498570,85150,LADIES & GENTLEMEN METAL SIGN,2,02/12/2010,2.55,15059,United Kingdom,5.10
513747,21745,GAOLERS KEYS DECORATIVE GARDEN,8,27/08/2010,3.75,16571,United Kingdom,30.00
498724,21592,RETRO SPOT CIGAR BOX MATCHES,144,07/12/2009,1.06,13340,United Kingdom,152.64
497226,22300,COFFEE MUG DOG + BALL DESIGN,24,17/09/2010,2.55,13394,United Kingdom,61.20
521642,84849,HOT BATHS SOAP HOLDER,12,29/09/2010,1.69,14911,EIRE,20.28
511783,21790,VINTAGE SNAP CARDS,2,05/09/2010,0.85,16713,United Kingdom,1.70
528310,22769,CHALKBOARD KITCHEN ORGANISER,8,18/03/2010,21.95,14156,EIRE,175.60
514161,16161,"WRAP,SUKI AND FRIENDS",25,10/03/2010,0.42,13875,United Kingdom,10.50
515126,21126,SET OF 6 GIRLS CELEBRATION CANDLES,12,13/12/2009,1.25,16650,United Kingdom,15.00
499475,84795,OCEAN STRIPE HAMMOCK,1,08/07/2010,7.95,15990,United Kingdom,7.95
505551,22477,WATERING CAN GARDEN MARKER,10,27/04/2010,1.25,16497,United Kingdom,12.50
535932,22577,WOODEN HEART CHRISTMAS SCANDINAVIAN,24,14/12/2009,0.85,13590,United Kingdom,20.40
492948,21484,CHICK GREY HOT WATER BOTTLE,1,30/09/2010,3.45,14606,United Kingdom,3.45
500336,21058,PARTY INVITES WOODLAND,4,13/06/2010,0.85,17589,United Kingdom,3.40
497912,22249,DECORATION WHITE CHICK MAGIC GARDEN,10,07/11/2010,0.85,12867,United Kingdom,8.50
494682,22300,COFFEE MUG DOG + BALL DESIGN,6,29/10/2010,2.55,14754,United Kingdom,15.30
494390,84997,RED 3 PIECE MINI DOTS CUTLERY SET,4,22/01/2010,3.75,18041,United Kingdom,15.00
497740,21883,STARS GIFT TAPE,12,25/08/2010,0.65,13815,Germany,7.80
509764,22516,CHILDS GARDEN RAKE BLUE,6,10/05/2010,2.10,15421,United Kingdom,12.60
491716,47552,DOTS IRONING BOARD COVER,1,21/07/2010,1.95,14466,United Kingdom,1.95
535684,22457,NATURAL SLATE HEART CHALKBOARD,3,28/11/2010,2.95,16359,United Kingdom,8.85
503933,22499,WOODEN UNION JACK BUNTING,3,25/02/2010,5.95,18065,United Kingdom,17.85
532325,21730,GLASS STAR FROSTED T-LIGHT HOLDER,6,01/02/2010,4.95,16735,United Kingdom,29.70
500327,35971,ROSE FOLKART HEART DECORATIONS,4,26/04/2010,1.25,17913,United Kingdom,5.00
516960,21135,VICTORIAN METAL POSTCARD SPRING,16,14/12/2009,1.69,12949,United Kingdom,27.04
500567,21232,STRAWBERRY CERAMIC TRINKET BOX,72,16/09/2010,1.06,13694,United Kingdom,76.32
509440,20726,LUNCH BAG WOODLAND,20,23/11/2010,1.65,12921,United Kingdom,33.00
522978,85123,WHITE HANGING HEART T-LIGHT HOLDER,6,01/07/2010,2.95,17085,United Kingdom,17.70
496900,20997,ROSE DU SUD CUSHION COVER,3,06/06/2010,4.95,17138,United Kingdom,14.85
495031,84580,MOUSE TOY WITH PINK T-SHIRT,1,08/11/2010,3.75,16933,United Kingdom,3.75
492742,20679,EDWARDIAN PARASOL RED,3,18/02/2010,5.95,12455,Cyprus,17.85
522711,21981,PACK OF 12 WOODLAND TISSUES,1,28/09/2010,0.29,17348,United Kingdom,0.29
516891,21504,SKULLS GREETING CARD,12,14/11/2010,0.42,14312,United Kingdom,5.04
503790,21164,HOME SWEET HOME METAL SIGN,1,07/10/2010,2.95,13174,United Kingdom,2.95
492763,84880,WHITE WIRE EGG HOLDER,12,19/11/2010,4.95,17028,United Kingdom,59.40
495073,79323,BLACK CHERRY LIGHTS,24,30/11/2010,5.45,14911,EIRE,130.80
519512,21629,SQUARE FLOOR CUSHION VINTAGE RED,4,01/11/2010,7.95,17293,United Kingdom,31.80
500664,21673,WHITE SPOT BLUE CERAMIC DRAWER KNOB,24,07/11/2010,1.25,17841,United Kingdom,30.00
498611,21754,HOME BUILDING BLOCK WORD,6,18/12/2009,5.95,13540,United Kingdom,35.70
518230,21867,PINK UNION JACK LUGGAGE TAG,6,25/11/2010,1.25,14395,United Kingdom,7.50
521038,22352,LUNCH BOX WITH CUTLERY RETROSPOT,12,16/12/2009,2.55,12589,France,30.60
496595,21896,POTTING SHED TWINE,3,02/08/2010,2.10,13042,United Kingdom,6.30
517578,20719,WOODLAND CHARLOTTE BAG,10,16/03/2010,0.85,14346,United Kingdom,8.50
533293,35968,FOLK ART METAL HEART T-LIGHT HOLDER,24,14/11/2010,0.38,16145,United Kingdom,9.12
504638,22517,CHILDS GARDEN RAKE PINK,6,23/05/2010,2.10,18245,United Kingdom,12.60
531506,21731,RED TOADSTOOL LED NIGHT LIGHT,12,24/02/2010,1.65,12472,Germany,19.80
531362,22694,WICKER STAR,2,29/06/2010,2.10,13561,United Kingdom,4.20
513190,15056,EDWARDIAN PARASOL BLACK,2,16/09/2010,5.95,16894,United Kingdom,11.90
497956,20679,EDWARDIAN PARASOL RED,3,18/04/2010,5.95,17136,United Kingdom,17.85
524308,22412,METAL SIGN NEIGHBOURHOOD WITCH,12,16/04/2010,2.10,16198,United Kingdom,25.20
499013,21980,PACK OF 12 RED SPOTTY TISSUES,48,07/10/2010,0.29,12909,United Kingdom,13.92
492593,22339,CHRISTMAS TREE PAINTED ZINC,4,13/12/2009,0.65,15917,United Kingdom,2.60
499998,21380,WOODEN HAPPY BIRTHDAY GARLAND,6,07/06/2010,2.95,14156,EIRE,17.70
515165,22384,LUNCH BAG PINK RETROSPOT,10,09/12/2009,1.65,13564,United Kingdom,16.50
490899,21775,DECORATIVE FLORE BATHROOM BOTTLE,12,26/11/2010,1.25,16732,United Kingdom,15.00
515411,21085,SET/6 WOODLAND PAPER CUPS,1,24/11/2010,0.65,14667,United Kingdom,0.65
529831,22751,FELTCRAFT PRINCESS OLIVIA DOLL,1,06/06/2010,3.75,17950,United Kingdom,3.75
512889,22473,TV DINNER TRAY VINTAGE PAISLEY,1,02/12/2009,4.95,16797,United Kingdom,4.95
523203,21272,SALLE DE BAIN HOOK,12,08/04/2010,1.25,14152,United Kingdom,15.00
491812,20657,TROPICAL LUGGAGE TAG,200,28/02/2010,0.38,13694,United Kingdom,76.00
529842,22178,VICTORIAN GLASS HANGING T-LIGHT,3,25/07/2010,1.25,15038,United Kingdom,3.75
507364,22161,HEART DECORATION RUSTIC HANGING,2,02/09/2010,0.65,17808,United Kingdom,1.30
519621,84792,ENCHANTED BIRD COATHANGER 5 HOOK,12,19/05/2010,4.65,14852,United Kingdom,55.80
528868,22296,HEART IVORY TRELLIS LARGE,1,11/11/2010,1.65,15976,United Kingdom,1.65
497926,21398,RED SPOTTY COFFEE MUG,6,23/11/2010,2.10,12426,Germany,12.60
511545,21094,SET/6 RED SPOTTY PAPER PLATES,24,12/09/2010,0.85,15179,United Kingdom,20.40
508900,84949,SILVER HANGING T-LIGHT HOLDER,6,01/07/2010,1.65,16835,United Kingdom,9.90
519341,21755,LOVE BUILDING BLOCK WORD,2,07/07/2010,5.95,15050,United Kingdom,11.90
502450,21109,"LARGE CAKE TOWEL, CHOCOLATE SPOTS",2,25/02/2010,6.75,14026,United Kingdom,13.50
497691,21733,RED HANGING HEART T-LIGHT HOLDER,12,27/06/2010,2.95,14040,United Kingdom,35.40
523431,82580,BATHROOM METAL SIGN,2,16/09/2010,0.55,17819,United Kingdom,1.10
500611,21844,RETRO SPOT MUG,4,22/11/2010,2.95,17266,United Kingdom,11.80
523360,22029,SPACEBOY BIRTHDAY CARD,12,29/09/2010,0.36,17850,United Kingdom,4.32
508333,84925,PSYCHEDELIC WALL THERMOMETER,96,02/12/2010,0.85,13694,United Kingdom,81.60
499629,21244,BLUE SPOTTY PLATE,8,09/05/2010,1.69,17324,United Kingdom,13.52
502653,20914,SET/5 RED SPOTTY LID GLASS BOWLS,6,29/10/2010,2.95,17160,United Kingdom,17.70
496058,15056,EDWARDIAN PARASOL BLACK,4,25/05/2010,5.95,17115,United Kingdom,23.80
520847,22753,SMALL YELLOW BABUSHKA NOTEBOOK,1,08/06/2010,0.85,16791,United Kingdom,0.85
536088,22634,CHILDS BREAKFAST SET SPACEBOY,2,12/11/2010,9.95,16782,United Kingdom,19.90
503156,22562,MONSTERS STENCIL CRAFT,1,05/05/2010,1.25,15862,United Kingdom,1.25
525020,21166,COOK WITH WINE METAL SIGN,7,09/03/2010,1.95,13590,United Kingdom,13.65
491717,90214,"LETTER ""S"" BLING KEY RING",1,25/08/2010,1.25,16725,United Kingdom,1.25
502238,20799,PINK MILKSHAKE GLASS,6,08/02/2010,2.10,16296,United Kingdom,12.60
507622,22250,DECORATION BUTTERFLY MAGIC GARDEN,6,22/07/2010,0.85,17579,United Kingdom,5.10
494866,22138,BAKING SET 9 PIECE RETROSPOT,4,28/09/2010,4.95,16253,United Kingdom,19.80
490013,20753,RETRO PINK SPOT WASHING UP GLOVES,6,19/01/2010,2.10,17069,United Kingdom,12.60
531750,79321,CHILLI LIGHTS,3,04/10/2010,4.95,15325,United Kingdom,14.85
502565,21781,MA CAMPAGNE CUTLERY BOX,1,02/12/2009,14.95,13849,United Kingdom,14.95
535345,22855,FINE WICKER HEART,12,28/02/2010,1.25,15936,United Kingdom,15.00
521888,21059,PARTY INVITES DINOSAURS,144,16/02/2010,0.72,12770,Japan,103.68
519557,22197,SMALL POPCORN HOLDER,12,24/11/2010,0.85,15421,United Kingdom,10.20
536205,22194,BLACK DINER WALL CLOCK,2,15/09/2010,8.50,13078,United Kingdom,17.00
525295,22740,POLKADOT PEN,48,26/10/2010,0.85,14911,EIRE,40.80
509613,"22,508.00",DOORSTOP RETROSPOT HEART,-1,15/10/2010,3.75,17716,United Kingdom,-3.75
532021,72128,COLUMBIAN CANDLE ROUND,1,24/05/2010,0.85,16208,United Kingdom,0.85
494873,20686,DOLLY MIXTURE CHILDREN'S UMBRELLA,6,16/07/2010,3.25,12589,France,19.50
521999,21931,JUMBO STORAGE BAG SUKI,2,20/05/2010,1.95,14445,United Kingdom,3.90
500135,15036,ASSORTED COLOURS SILK FAN,24,26/10/2010,0.75,16096,United Kingdom,18.00
515591,22093,MOTORING TISSUE BOX,4,25/11/2010,1.25,13428,United Kingdom,5.00
503809,21500,PINK SPOTS WRAP,300,24/09/2010,0.34,15061,United Kingdom,102.00
529077,47556,TEA TIME TEA TOWELS,1,01/11/2010,2.95,16372,United Kingdom,2.95
494868,84837,WHITE SWEETHEARTS CABINET 4 DRAWERS,6,14/07/2010,12.75,17706,United Kingdom,76.50
521767,22483,RED GINGHAM TEDDY BEAR,2,25/04/2010,2.95,15752,United Kingdom,5.90
501732,22138,BAKING SET 9 PIECE RETROSPOT,3,24/10/2010,4.95,14292,United Kingdom,14.85
528647,22188,BLACK HEART CARD HOLDER,1,30/06/2010,3.95,14277,France,3.95
512694,21172,PARTY METAL SIGN,2,29/06/2010,1.45,14710,United Kingdom,2.90
523320,22154,ANGEL DECORATION 3 BUTTONS,1,05/05/2010,0.42,14169,United Kingdom,0.42
536954,22943,CHRISTMAS LIGHTS 10 VINTAGE BAUBLES,100,23/11/2010,4.25,17809,United Kingdom,425.00
524596,21429,RED GINGHAM ROSE JEWELLERY BOX,8,06/12/2010,1.65,15144,United Kingdom,13.20
509008,84685,BEACH HUT KEY CABINET,16,27/05/2010,1.25,15157,United Kingdom,20.00
521796,21224,SET/4 SKULL BADGES,2,23/04/2010,1.25,17220,United Kingdom,2.50
518205,85099,JUMBO BAG RED RETROSPOT,100,17/10/2010,1.65,13093,United Kingdom,165.00
501889,22380,TOY TIDY SPACEBOY,15,07/03/2010,2.10,13093,United Kingdom,31.50
496085,21484,CHICK GREY HOT WATER BOTTLE,2,05/07/2010,3.45,14702,United Kingdom,6.90
493446,22228,BUNNY WOODEN PAINTED WITH BIRD,3,07/06/2010,0.85,17807,United Kingdom,2.55
519477,22371,AIRLINE BAG VINTAGE TOKYO 78,4,10/08/2010,6.35,13001,United Kingdom,25.40
525888,22591,CARDHOLDER GINGHAM CHRISTMAS TREE,6,16/05/2010,2.55,16906,United Kingdom,15.30
502613,21533,RETRO SPOT LARGE MILK JUG,1,01/03/2010,4.95,14535,United Kingdom,4.95
528944,21506,"FANCY FONT BIRTHDAY CARD,",24,24/03/2010,0.42,15142,United Kingdom,10.08
510291,21745,GAOLERS KEYS DECORATIVE GARDEN,4,25/02/2010,3.75,13338,United Kingdom,15.00
496961,22253,6 CROCHET STRAWBERRIES,2,25/08/2010,1.25,17231,United Kingdom,2.50
530655,21980,PACK OF 12 RED RETROSPOT TISSUES,24,13/08/2010,0.29,13987,United Kingdom,6.96
534704,22833,HALL CABINET WITH 3 DRAWERS,4,24/09/2010,45.95,16003,United Kingdom,183.80
508037,22122,SET OF 2 FANCY FONT TEA TOWELS,2,28/11/2010,2.95,16891,United Kingdom,5.90
512259,82583,HOT BATHS METAL SIGN,1,26/08/2010,2.10,17059,United Kingdom,2.10
516768,21781,MA CAMPAGNE CUTLERY BOX,2,31/10/2010,14.95,16588,United Kingdom,29.90
535593,47585,PINK FAIRY CAKE CUSHION COVER,4,22/06/2010,3.75,13362,United Kingdom,15.00
525102,22483,RED GINGHAM TEDDY BEAR,12,13/05/2010,2.95,16652,United Kingdom,35.40
506003,21165,BEWARE OF THE CAT METAL SIGN,48,15/02/2010,1.45,16652,United Kingdom,69.60
491840,21429,RED GINGHAM ROSE JEWELLERY BOX,4,21/06/2010,1.65,15015,United Kingdom,6.60
514387,21891,TRADITIONAL WOODEN SKIPPING ROPE,12,15/10/2010,1.25,12633,Germany,15.00
504356,21527,RED RETROSPOT TRADITIONAL TEAPOT,2,02/02/2010,7.95,12835,United Kingdom,15.90
516302,22456,NATURAL SLATE CHALKBOARD LARGE,7,09/12/2010,4.95,14062,United Kingdom,34.65
497202,21775,DECORATIVE FLORE BATHROOM BOTTLE,1,20/01/2010,1.25,15059,United Kingdom,1.25
527427,22547,MINI JIGSAW DINOSAUR,3,27/05/2010,0.42,15555,United Kingdom,1.26
497209,21213,PACK OF 72 SKULL CAKE CASES,1,01/12/2010,0.55,16788,United Kingdom,0.55
535266,22867,HAND WARMER BIRD DESIGN,2,19/11/2010,2.10,14159,United Kingdom,4.20
534870,84969,BOX OF 6 ASSORTED COLOUR TEASPOONS,1,10/03/2010,4.25,17601,United Kingdom,4.25
514165,21936,RED RETROSPOT PICNIC BAG,5,19/01/2010,2.95,12714,France,14.75
511734,22585,PACK OF 6 BIRDY GIFT TAGS,12,11/10/2010,1.25,17158,United Kingdom,15.00
530350,22588,CARD HOLDER GINGHAM HEART,2,09/09/2010,2.55,14506,United Kingdom,5.10
516162,22149,FELTCRAFT 6 FLOWER FRIENDS,4,16/09/2010,2.10,14553,United Kingdom,8.40
498365,84946,ANTIQUE SILVER TEA GLASS ETCHED,12,19/04/2010,1.25,13579,United Kingdom,15.00
532325,21870,I CAN ONLY PLEASE ONE PERSON MUG,12,11/05/2010,1.25,16735,United Kingdom,15.00
517125,20677,PINK SPOTTY BOWL,8,30/04/2010,1.25,13466,United Kingdom,10.00
537192,21107,CREAM SLICE FLANNEL PINK SPOT,1,28/04/2010,2.95,16402,United Kingdom,2.95
527251,22752,SET 7 BABUSHKA NESTING BOXES,4,07/11/2010,8.50,17687,United Kingdom,34.00
500721,21175,GIN + TONIC DIET METAL SIGN,4,03/10/2010,2.10,17059,United Kingdom,8.40
508628,21765,HANGING METAL BIRD BATH,1,29/11/2010,7.95,15280,United Kingdom,7.95
526217,22595,CHRISTMAS GINGHAM HEART,1,01/09/2010,0.85,14390,United Kingdom,0.85
512742,22625,RED KITCHEN SCALES,2,19/08/2010,8.50,16746,United Kingdom,17.00
520680,21399,BLUE SPOTTY COFFEE MUG,6,30/03/2010,2.10,15480,Malta,12.60
523371,22468,BABUSHKA LIGHTS STRING OF 10,12,15/03/2010,5.95,17850,United Kingdom,71.40
511062,22423,REGENCY CAKESTAND 3 TIER,16,05/08/2010,10.95,16652,United Kingdom,175.20
528377,48111,DOORMAT 3 SMILEY CATS,1,31/08/2010,7.95,15998,United Kingdom,7.95
491811,21527,RETRO SPOT TRADITIONAL TEAPOT,1,07/10/2010,7.95,12835,United Kingdom,7.95
516577,"21,232.00",STRAWBERRY CERAMIC TRINKET BOX,-1,16/11/2010,1.25,15791,United Kingdom,-1.25
516781,21745,GAOLERS KEYS DECORATIVE GARDEN,204,09/12/2010,2.54,18102,United Kingdom,518.16
510435,72741,GRAND CHOCOLATECANDLE,18,06/07/2010,1.45,14454,United Kingdom,26.10
512286,72800,4 IVORY DINNER CANDLES SILVER FLOCK,4,29/03/2010,2.55,15967,United Kingdom,10.20
511281,22066,LOVE HEART TRINKET POT,12,03/06/2010,1.45,18100,United Kingdom,17.40
491452,21484,CHICK GREY HOT WATER BOTTLE,1,13/05/2010,3.45,17238,United Kingdom,3.45
515127,21672,WHITE SPOT RED CERAMIC DRAWER KNOB,12,11/01/2010,1.25,14695,United Kingdom,15.00
498052,22494,EMERGENCY FIRST AID TIN,12,21/09/2010,1.25,17404,Sweden,15.00
520337,21558,SKULL LUNCH BOX WITH CUTLERY,6,10/01/2010,2.55,15950,United Kingdom,15.30
491635,20714,POSY SHOPPER BAG,200,30/03/2010,0.38,14298,United Kingdom,76.00
504548,21790,VINTAGE SNAP CARDS,12,21/04/2010,0.85,14210,United Kingdom,10.20
491111,20671,BLUE TEATIME PRINT BOWL,8,07/06/2010,1.25,15005,United Kingdom,10.00
505328,21240,BLUE SPOTTY CUP,4,04/11/2010,0.85,14527,United Kingdom,3.40
501443,22565,FELTCRAFT HAIRBANDS PINK AND WHITE,3,18/01/2010,0.85,15005,United Kingdom,2.55
502638,21498,RED SPOTS WRAP,25,11/07/2010,0.42,15260,United Kingdom,10.50
529850,21929,JUMBO BAG PINK VINTAGE PAISLEY,2,10/11/2010,1.95,16788,United Kingdom,3.90
521483,48129,DOORMAT TOPIARY,10,14/01/2010,6.35,13093,United Kingdom,63.50
522821,22296,HEART IVORY TRELLIS LARGE,12,18/12/2009,1.65,14734,United Kingdom,19.80
500719,22030,SWALLOWS GREETING CARD,12,07/11/2010,0.42,16707,United Kingdom,5.04
497402,21618,4 WILDFLOWER BOTANICAL CANDLES,6,28/05/2010,3.75,16873,United Kingdom,22.50
497369,22386,JUMBO BAG PINK WITH WHITE SPOTS,20,10/05/2010,1.95,16746,United Kingdom,39.00
523722,22663,JUMBO BAG DOLLY GIRL DESIGN,1,11/04/2010,1.95,16261,United Kingdom,1.95
530568,22630,DOLLY GIRL LUNCH BOX,2,22/10/2010,1.95,13554,United Kingdom,3.90
536049,84559,3D SHEET OF CAT STICKERS,24,26/09/2010,0.85,15382,United Kingdom,20.40
533511,22906,12 MESSAGE CARDS WITH ENVELOPES,12,19/09/2010,1.65,15882,United Kingdom,19.80
500336,22185,SLATE TILE NATURAL HANGING,2,05/10/2010,1.65,17589,United Kingdom,3.30
515437,22377,BOTTLE BAG RETROSPOT,2,08/03/2010,2.10,17068,United Kingdom,4.20
522943,POST,POSTAGE,5,09/12/2010,28,12543,Spain,140.00
497948,84247,"DECOUPAGE,GREETING CARD,",12,25/07/2010,0.42,13081,United Kingdom,5.04
490538,15056,EDWARDIAN PARASOL BLACK,6,13/04/2010,4.95,17850,United Kingdom,29.70
501010,21164,HOME SWEET HOME METAL SIGN,3,31/10/2010,2.95,13715,United Kingdom,8.85
533554,22867,HAND WARMER BIRD DESIGN,12,04/12/2009,2.10,13605,United Kingdom,25.20
521119,22603,CHRISTMAS RETROSPOT TREE WOOD,4,17/11/2010,0.85,17068,United Kingdom,3.40
518771,21561,DINOSAUR LUNCH BOX WITH CUTLERY,1,15/11/2010,2.55,14736,United Kingdom,2.55
525310,22150,3 STRIPEY MICE FELTCRAFT,6,14/10/2010,1.95,13177,United Kingdom,11.70
495707,21651,HANGING GLASS ETCHED TEALIGHT,6,05/08/2010,1.65,14478,United Kingdom,9.90
522097,22151,PLACE SETTING WHITE HEART,96,07/11/2010,0.42,14898,United Kingdom,40.32
529587,21558,SKULL LUNCH BOX WITH CUTLERY,1,13/04/2010,2.55,13780,United Kingdom,2.55
514665,22088,PAPER BUNTING COLOURED LACE,1,28/10/2010,2.95,16110,United Kingdom,2.95
505709,22389,PAPERWEIGHT SAVE THE PLANET,2,09/11/2010,2.55,13050,United Kingdom,5.10
491165,79000,MOROCCAN TEA GLASS,144,15/03/2010,0.65,14293,United Kingdom,93.60
512177,20694,FLORAL PINK MONSTER,4,19/08/2010,3.75,15150,United Kingdom,15.00
516753,21527,RED RETROSPOT TRADITIONAL TEAPOT,1,26/09/2010,7.95,18026,United Kingdom,7.95
525892,22737,RIBBON REEL CHRISTMAS PRESENT,1,16/12/2009,1.65,16411,United Kingdom,1.65
504519,35001,HAND OPEN SHAPE GOLD,2,10/06/2010,4.25,15563,United Kingdom,8.50
514004,84279,CHERRY BLOSSOM DECORATIVE FLASK,4,07/11/2010,3.75,14156,EIRE,15.00
501909,21314,SMALL GLASS HEART TRINKET POT,16,28/04/2010,2.10,14051,United Kingdom,33.60
523867,85047,WHITE BEADED GARLAND STRING 20LIGHT,2,16/12/2009,6.35,13174,United Kingdom,12.70
510936,22274,FELTCRAFT DOLL EMILY,6,23/08/2010,2.95,12701,Germany,17.70
512409,22293,"SPRING DEC , HANGING CHICK GREEN",24,27/05/2010,1.45,16307,United Kingdom,34.80
508800,22386,JUMBO BAG PINK WITH WHITE SPOTS,1,12/07/2010,1.95,15311,United Kingdom,1.95
498774,21509,COWBOYS AND INDIANS BIRTHDAY CARD,12,15/04/2010,0.42,13330,United Kingdom,5.04
498614,21466,RED FLOWER CROCHET FOOD COVER,6,28/09/2010,3.75,14849,United Kingdom,22.50
509428,22348,TEA BAG PLATE RED SPOTTY,1,10/08/2010,0.85,16549,United Kingdom,0.85
530061,21257,VICTORIAN SEWING BOX MEDIUM,2,13/10/2010,7.95,13115,United Kingdom,15.90
504119,20886,BOX OF 9 PEBBLE CANDLES,3,25/10/2010,1.95,17609,United Kingdom,5.85
497739,84948,SILVER HANGING T-LIGHT HOLDER DOME,3,19/07/2010,1.65,14606,United Kingdom,4.95
